,body,cites_papers
0,"""In-situ spatio-temporal measurements of the detailed azimuthal substructure    "" by   et al",[2094918]
1,"6$ for a 48h checkout of an article, restricted to a proprietary system    I guess that's supposed to be a bargain?",[2950824]
2,"Gas from many, large, violent Siberian pipe eruptions in end-Permian extinction",[4234292]
3,"A new ornithuromorph  Aves  with an elongate rostrum from the Jehol Biota, and the early evolution of rostralization",[4978753]
4,E  Triassic polar predator ecosystem revealed by vertebrate coprolites from Bulgo Sandstone of S E  Australia  ,[6763948]
5,New Minisauripus site from Lower Cretaceous of China  Tracks of small adults or juveniles?  ,[6763949]
6,"""A new Minisauripus site from the Lower Cretaceous of China  Tracks of small adults or juveniles?""",[6763949]
7,OS Carbon-based phytoplankton size classes retrieved via ocean color estimates of the particle size distribution,[6774644]
8,Oceanography OS  Carbon-based phytoplankton size classes retrieved via ocean color estimates of the particle size,[6774644]
9,"CP Ocean carbon cycling during the past 130,000 years  a pilot study on inverse paleoclimate record modelling",[6779361]
10,"Ocean carbon cycling during the past 130,000 years  a pilot study on inverse paleoclimate record modelling  O",[6779361]
11,"Ocean carbon cycling during the past 130,000 years  a pilot study on inverse paleoclimate record modelling",[6779361]
12,"New paper  Ocean carbon cycling during the past 130,000 years  a pilot study on inverse paleoclimate record m",[6779361]
13,General models of ecological diversification I and II and,"[6815271,6815274]"
14,New enantiornithine Linyiornis amoena   birds  dinosaurs,[4980643]
15,Global trends of pCO2 across KPg supported by 1st S  Hemisphere stomatal proxy-based pCO2 reconstruction  OA,[6827269]
16,"Study of ~60,000 year record of foraminifera from the Gulf of Alaska identifies no-analog fossil assemblages",[6836432]
17,Belanger et al  develop tests for down-slope transport of benthic forams using modern-analogue data from Gulf Alaska,[6836432]
18,Benthic foraminiferal faunas reveal transport dynamics and no-analog environments on a glaciated margin,[6836432]
19,"New issue of Paleobiology out, with a nice paper on late Pz ice age paleoecology in ice-proximal areas",[6838310]
20,"Redescription ofE  Triassic Saurichthys madagascariensis, and  the E  saurichthyid morphotype    - v",[6846249]
21,"The Saurichthys revolution continues, with a redescription of the Early Triassic S  madagascarensis",[6846249]
22,"Protomiamia yangigen  et sp  nov , a sexually dimorphic Palaeozoic stem-Orthoptera    - v",[6852120]
23,"New online  Protomiamia yangi  Pennsylvanian  Xiaheyan, China , a sexually dimorphic Palaeozoic stem-Orthoptera",[6852120]
24,300Ma old remote relative of crickets and  grasshoppers  Male 2/3 size of female  FossilFriday,[6852120]
25,"New 3D Jehol bird with egg follicles  Linyiornis amoena, 'beautiful bird from Linyi'  China",[4980643]
26,"New online  Protomiamia yangi  Pennsylvanian  Xiaheyan, China , a sexually dimorphic Palaeozoic stem-Orthoptera ",[6852120]
27,300Ma old remote relative of crickets and  grasshoppers  Male 2/3 size of female  FossilFriday ht,[6852120]
28,"Protomiamia yangi gen  et sp  nov   Early Pennsylvanian  China , a sexually dimorphic Palaeozoic stem-Orthoptera",[6852120]
29,OS Seasonal and interannual variability of coccolithophore blooms in  the North East-Atlantic Ocean from a 18-yea,[6860575]
30,Oceanography OS  Seasonal and interannual variability of coccolithophore blooms in  the North East-Atlantic Ocean,[6860575]
31,Open Access UCL Research  Revisiting carbonate chemistry controls on planktic foraminifera Mg/Ca  implications,[6862567]
32,New plotopterid material described by Mayr and  Goedert in,[6870561]
33,"New Eo-Oligocene remains of plotopterids from W  Washington State, US    - v",[6870561]
34,New plotopterids from WA,[6870561]
35,"New pub  Klallamornis and  Olympidyptes, flightless penguin-like birds from Eo-Oligocene of WA",[6870561]
36,A new Jehol enantiornithine bird with 3D preservation and  ovarian follicles    - v,[4980643]
37,"New pub  Klallamornis and  Olympidyptes, flightless penguin-like birds from Eo-Oligocene of WA ",[6870561]
38,"New late Eocene and  Oligocene remains of flightless penguin-like plotopterids, western Washington State  ornithology",[6870561]
39,"New late Eocene and  Oligocene remains of flightless penguin-like plotopterids, western Washington State",[6870561]
40,"New ichnotaxon, Lepeichnus giberti, and new ichnological concept  Ichnogeny are presented    FossilFriday ",[6871254]
41,"New ichnotaxon, Lepeichnus giberti, and new ichnological concept  Ichnogeny are presented    FossilFriday",[6871254]
42,New trace fossil named in honour of the much-missed Jordi de Gibert introduces concept of  ichnogeny,[6871254]
43,CP A  413-year  tree-ring  based  April-July  minimum  temperature  reconstruction and its implications on the ex,[6887809]
44,A 413-year tree-ring based April-July minimum temperature reconstruction and its implications on the extreme,[6887809]
45,A  413-year  tree-ring  based  April-July  minimum  temperature  reconstruction and its implications on the ex,[6887809]
46,New paper  A  413-year  tree-ring  based  April-July  minimum  temperature  reconstruction and its implication,[6887809]
47,"New 3D Jehol bird with egg follicles  Linyiornis amoena, 'beautiful bird from Linyi'  China ",[4980643]
48,"Oceanography OS  Design and validation of MEDRYS, a Mediterranean Sea  reanalysis over the period 19922013",[6896232]
49,"OS Design and validation of MEDRYS, a Mediterranean Sea  reanalysis over the period 19922013",[6896232]
50,Earliest record of the genusLariosaurusfrom M  Triassic of Germanic Basin    - v,[6904822]
51,New in    Judy Massare and    have a look at Ichthyosaurus  marinereptiles,[6916865]
52,"Oi, what's this paywall doing around you paper?     Also, congrats, looks awesome!",[6916865]
53,"New specimen ofIchthyosaurus conybeari from Somerset, U K , and  a re-examination of species    - v",[6916865]
54,Ostracods as proxies for past  seagrass,[6935770]
55,Oceanography OS  ,[6939836]
56,"New online  Gabaleryon, a new genus of widespread early Toarcian polychelidan lobsters",[6945295]
57,A new  Jehol  enantiornithine  bird with three-dimensional preservation and ovarian follicles,[4980643]
58,"Gabaleryon, a new genus of widespread early Toarcian polychelidan lobsters    - v",[6945295]
59,"Gabaleryon, a new genus of widespread early Toarcian polychelidan lobsters",[6945295]
60,"FossilFriday Jurassic polychelidan lobster recently described from Brenoux, France",[6945295]
61,New paper  Changes in Holocene meridional circulation and poleward Atlantic flow  the Bay of Biscay as a nodal point,[6947099]
62,Changes in Holocene meridional circulation and poleward Atlantic flow  the Bay of Biscay as a nodal point,[6947099]
63,Greenland warming during the last interglacial  the relative importance of insolation and oceanic changes,[6960050]
64,Greenland warming during the last interglacial  the relative importance of insolation and oceanic changes  Gre,[6960050]
65,Greenland warming during the last interglacial  the relative importance of insolation and oceanic changes  climate,[6960050]
66,CP Greenland warming during the last interglacial  the relative importance of insolation and oceanic changes,[6960050]
67,New paper  Greenland warming during the last interglacial  the relative importance of insolation and oceanic changes,[6960050]
68,OS Mapping turbulent diffusivity associated with oceanic internal lee waves offshore Costa Rica,[6961047]
69,Oceanography OS  Mapping turbulent diffusivity associated with oceanic internal lee waves offshore Costa Rica,[6961047]
70,5 Myr old  Deinotherium bone fragment is so far the oldest mammal bone found from  Finland,[6967137]
71,Bet you didn't see this coming  a Miocene  Deinotherium from Finland! Congrats   et al !,[6967137]
72,5 mill yrs old  deinotherium fossil from Finland! Ping,[6967137]
73,Here,[6967137]
74,A 5 million year old Deinotherium found in Finland  Perfect for  PlioceneWeek HT,[6967137]
75,Stable isotopes show resource partitioning among E  Late Miocene herbivore community at Rudabnya II  ,[6979823]
76,"Amazing research    by Currie and  colleagues of  ! Also check out the new   in Wembley, Alberta","[4980975,4980975]"
77,  Th,[6979855]
78,New paper  ,[6979855]
79,    Fish feeding trace fossil  Lower Devonian of the Holy Cross Mountains,[7060928]
80,"Fish feeding trace fossil from the Lower Devonian of the Holy Cross Mountains  Osculichnus  literally, kiss mark",[7060928]
81,Fun trace fossil  imprints of lungfish noses rooting in Early Devonian mud!,[7060928]
82,"    Diet and locomotion,not body size, differentiate mammal communities in  tropical ecosystems",[7060937]
83,New mammal faunal data from Bolivia that shows end of S  American M  Miocene Climatic Optimum    - v,[7065643]
84,"New mammal faunal data from Cerdas, Bolivia",[7065643]
85,New online  Fossil evidence of social insect commensalism in the Phoridae  Insecta  Diptera,[7065667]
86,Such anticipation  Much satisfaction  So Chasmosaurus,[4980975]
87,Fossil evidence of social insect commensalism in the Phoridae    - v,[7065667]
88,Fossil evidence of social insect commensalism in the Phoridae  Insecta  Diptera,[7065667]
89,Systematic description of putative animal  fossils from the early Ediacaran Lantian Formation of South China,[7069723]
90,Earth's earliest animals? New Ediacaran fossils provide tantalizing evidence  fossilfriday,[7069723]
91,Do you want to know more about the diet of sabertooth cats and other Miocene predators? Check out  CC/,[7075345]
92,A colleague just mocked the title of my latest paper  Let me know what you think,[7083947]
93,"Organic matter in U  Albian marine sediments in High-Tatric units, C  W  Carpathians and  Oceanic Anoxic Event 1d  ",[7087977]
94,Our new paper on lake variability during the last 900 years in Lutzow-Holm Bay  Antarctica  diatoms,[7090797]
95,Our new paper on lake variability during the last 900 years in Lutzow-Holm Bay  Antarctica  diatoms    ,[7090797]
96,Juvenile chasmosaur paper is out in JVP  Great specimen!,[4980975]
97,"New paper  Bergstrm et al in press  Upper Ordovician 13C chemostrat, K-bentonite strat, and  biostrat in Scandinavia",[7096882]
98,"""In press"" version of this paper can be checked and downloaded from",[7099265]
99,Stable isotopes in fossil mammal teeth and  environmental change in S W  S  Africa during Plio-Pleistocene  ,[7109994]
100,Proliferation of MISS-related microbial mats post P-T mass extinction in N  Paleo-Tethys  Evidence from W  China  ,[7109995]
101,OS Projected sea level rise and changes in extreme storm surge and wave events during the 21st century in the reg,[7111749]
102,Oceanography OS  Projected sea level rise and changes in extreme storm surge and wave events during the 21st cent,[7111749]
103,New science paper estimates future risk of coastal flooding in Singapore,[7111749]
104,Ichnology and  variability in Cenozoic Niger Delta  e g 's from cores in coastal swamp and  offshore depobelts  ,[7120750]
105,Benthic forams record environmental perturbations during Portugese Late PliensbachianEarly Toarcian interval  ,[7120751]
106,New results on solar wind driver efficiency and polar cap saturation   JGRSpace  SpaceWeather,[7130808]
107,The basalt pipes of the Tunguska Basin  Siberia   volatile degassing into the end-Permian atmosphere,[4234292]
108,Baby Chasmosaurus now out in JVP - what a fossil! A huge leap forward in our understanding of dino ontogeny,[4980975]
109,New info on  mammoths and   mastodons fr western Canada incl  RAM specimens  See  paleontology,[7132154]
110,"""Taxonomy, location of origin, and health status of proboscideans from "" by J Z Metcalfe, F Longstaffe et al",[7132154]
111,New info on  mammoths and   mastodons fr western Canada incl  RAM specimens  See  paleontology ,[7132154]
112,Paleobiology - ,[7133805]
113,OS Technical note  Harmonising metocean model data via standard web services within small research groups,[7138995]
114,Oceanography OS  Technical note  Harmonising metocean model data via standard web services within small research ,[7138995]
115,"Early sheep from Tibetan Pliocene,Protovis himalayensis, gen  et sp  nov  and  origin of group    - v",[7144094]
116,Protovis was a Tibetan sheep from the Pliocene and possible ancestor of modern bighorns,[7144094]
117,Protovis was a Tibetan sheep from the Pliocene and possible ancestor of modern bighorns  ,[7144094]
118,Pluto's Interaction with the Solar Wind - McComas - 2016 - Journal of Geophysical Research  Space Physics - Wiley,[7144707]
119,"Paper about the new baby Chasmosaurs, revealing horned dinosaur growth has been published in JVP",[4980975]
120,The astonishing results on the electromagnetic environments encompassing Pluto with the New Horizon measurements,[7144707]
121,New online  A revision of the genus Europicardium  tracking palaeogeography and  climate change,[7145650]
122,New online  A revision of the genus Europicardium  tracking palaeogeography and  climate change ht,[7145650]
123,"New rebbachisaurid cranial remains from Patagonian Cretaceous, and  1st S  American endocrania    - v",[7153123]
124,The MWA again features on the cover of a prestigious international journal  Journal of Geophysical Research -,[7161446]
125,"Our new paper using historical coral boulders to assess coastal vulnerability of tourist hotspot Koh Samui, Thailand",[7207374]
126,Coral boulders up to 4 7m above sea level imply some pretty energetic wave events in Thailand  Typhoons? Terry P3  j,[7207374]
127,"Incised Pleistocene valleys in W  Belgium coastal plain  Age, origins and  evolution of S  N  Sea Basin  ",[7218121]
128,New article in Paleobiology on the predatory behavior of the marsupial lion,[7262382]
129,Ecomorphology and the predatory behavior of the marsupial lion as revealed by elbow joint morphology,[7262382]
130,Amazing research    by Currie and  colleagues of  ! Also check out the new   in,[4980975]
131,"Marsupial lions primate-like forearms made it unique predator from Australia Paleobiology,",[7262382]
132,"Marsupial lions primate-like forearms made it unique predator from Australia Paleobiology, htt",[7262382]
133,"Diprotodontian marsupials  or *very* close cousins  from the Eocene of Patagonia,  Argentina! Lorente et al",[7295698]
134,Patagonian tarsals shed light on mysterious group of  fossil marsupials,[7295698]
135,On the existence of non-microbiotherian Australidelphian marsupials  Diprotodontia  in the Eocene of Patagonia,[7295698]
136,"Late Miocene methane-seep deposit bearing methane-trapping silica minerals at Joetsu, central Japan  ",[7296031]
137,Hyolithid with preserved soft parts from Ordovician Fezouata Konservat-Lagersttte of Morocco  ,[7296032]
138,Hyolithid soft anatomy revealed in the Fezouata Formation,[7296032]
139,A hyolithid with preserved soft parts from the Ordovician Fezouata Konservat-Lagersttte of Morocco,[7296032]
140,"A juvenile chasmosaurine ceratopsid from Dinosaur Park Formation, Alberta, Canada    - v",[4980975]
141,Environment during PETM in N E  Peri-Tethys revealed by high-res micropalaeo and  geochemical studies  ,[7352821]
142,My new paper's out!   observations of a solar energetic electron and  solar energetic proton event 2016 JGR,[7364106]
143,My new paper's out!   observations of a solar energetic electron and  solar energetic proton event 2016 JGR ,[7364106]
144,New study  BARREL observations of a solar energetic electron and proton event - nice work   !,[7364106]
145,New Jenkins and    Continent-scale biogeographic variation provinces v gradients  U Ordovician Laurentia,[7371845]
146,New paper in Paleobiology with Chelsea Jenkins  are  some  provinces really continental-scale gradients?,[7371845]
147,Oceanography OS  ,[7377094]
148,OS Occurrence and characteristics of mesoscale eddies in the tropical northeastern Atlantic Ocean,[7377773]
149,Oceanography OS  Occurrence and characteristics of mesoscale eddies in the tropical northeastern Atlantic Ocean,[7377773]
150,This is cute!  dinosaur  specimen,[4980975]
151,"Wisangocaris, A new chelicerate from the Cambrian Emy Bay Shale",[7379885]
152,  via,[7379885]
153,512 million-yr-old chelicerate predator from Australia for  FossilFriday,[7379885]
154,Early access  non fancy  version of my paper now available!  if you fancy a long read,[7403062]
155,"A survey of superthermal electron flux depressions, or electron holes  lra  leicester",[7403062]
156,"Controls on fossil pyritization  Redox, organic matter, and  Chuaria preservation in Ediacaran Lantian Biota  ",[7467223]
157,Environmental significance of morphological variations in foram Ammonia aomoriensis and  its molecular ID  ,[7490245]
158,Jurassic CO3 microfacies and  relative sea-level changes in Tethys Himalaya  S  Tibet   ,[7490247]
159,Reversal of Venusian magnetosphere in interplanetary magnetic field  AGUpubs,[7541052]
160,Another horribilis news for Creatards  Another evolution gap has been filled by a Canadian fossil of horned Dinosaur,[4980975]
161,Reversal of the Venusian magnetosphere in interplanetary magnetic field  AGUpubs,[7541052]
162,"New paper by STEPPE friends, Dr  Pedro Marenco et al , on ocean oxygenation associated with the Ordovician Radiation",[7561325]
163,Increasing global ocean oxygenation and  Ordovician Radiation  Insights from Th/U of CO3 from Ordovician of W  Utah  ,[7561325]
164,Marenco et al in press  Increasing global ocean oxygenation and  the Ordovician Radiation  insights from carbonate Th/U,[7561325]
165,"New paper by STEPPE friends, Dr  Pedro Marenco et al , on ocean oxygenation associated with the Ordovician Radiation htt",[7561325]
166,Nice paper on niche partitioning in extinct  crocodylians  Paleoecology,[7563757]
167,"Upper D region chemical kinetic modeling of LORE relaxation times, Gordillo-Vzquez, JGR  Space Physics,",[7565811]
168,Ecomorphological diversifications of Mesozoic marine reptiles  the roles of ecological opportunity and extinction  ,[7567443]
169,Rapid rise of Mesozoic marine reptiles shown by   in  Paleobiology,[7567443]
170,Ecomorphological diversifications of Mesozoic marine reptiles  ecological opportunity and extinction  FossilFriday,[7567443]
171,"A juvenile chasmosaurine ceratopsid  Dinosauria, Ornithischia  via",[4980975]
172,Ecomorphological diversifications of Mesozoic sea dragons  The roles of ecological opportunity and extinction,[7567443]
173,Nice look at morphologic diversification of marine reptiles in response to Mesozoic extinctions by,[7567443]
174,Ecomorphological diversifications of Mesozoic marine reptiles  the roles of ecological opportunity and extinction,[7567443]
175,Ecomorphological diversifications of Mesozoic sea dragons  ecological opportunity and  extinction   FossilFriday,[7567443]
176,"Check out my new paper about Mesozoic marine reptile macroevolution, its open access -",[7567443]
177,"Long before mammals dared to venture out to sea, reptiles recolonized oceans that their fishy ancestors left",[7567443]
178,"Himy friend I am an amateur hardcore sex, my nickname on the site Sexy69 -",[7567443]
179,Couple of interesting publications for budding herpetologists   Ecomorphological diversifications of Mesozoic,[7567443]
180,Just out ice mass readjustment during the last deglaciation of Lancashire  openaccess,[7586402]
181,Annual shell growth pattern of the Stimpson's hard clam Mercenaria stimpsoni revealed by  sclerochronology and  d18O,[7602005]
182,New Currie et al  JVP paper on beautiful baby horned dinosaur available for free   dinosaurs  fossils,[4980975]
183,Youbin Sun et al   High-res scanning XRF study Chinese loess- implications for millennial-scale monsoon variability,[7607353]
184,New open access paper  Scotland  sealevel and  Storegga  tsunami with,[7610299]
185,New open access paper  Scotland  sealevel and  Storegga  tsunami with   ,[7610299]
186,"ICYMI New paper on  sealevel change in northern Scotland, including new  Storegga deposit",[7610299]
187,"ICYMI New paper on  sealevel change in northern Scotland, including new  Storegga deposit   ",[7610299]
188,Oceanography OS  Assessing the potential for DMS enrichment at the sea-surface and its influence on airsea flux,[7617687]
189,OS Assessing the potential for DMS enrichment at the sea-surface and its influence on airsea flux,[7617687]
190,Oceanography OS  Mesoscale eddies and submesoscale structures of Persian Gulf Water off the Omani coast in spring,[8001180]
191,"New Algeo et al in press  Co-evolution of oceans, climate, and  the biosphere during the Ordovician Revolution A review",[8092324]
192,"A juvenile chasmosaurine ceratopsid  Dinosauria, Ornithischia  from the Dinosaur Park Formation, Alberta, Canada",[4980975]
193,"Co-evolution of oceans, climate, and the biosphere during the Ordovician Revolution  A review",[8092324]
194,New paper in PPP  Botting in press  ,[8092621]
195,"Diversity and ecology of sponges in Early Ordovician Fezouata Biota, Morocco  ",[8092621]
196,Exceptionally preserved sponges of the Ordovician Fezouata Biota,[8092621]
197,"Dermal denticle patterning in Tribodus limae, and  patterning in chondrichthyan dermal skeleton  OA  - v",[8110736]
198,New paper by John Denton and John Maisey on dermal denticle patterning in the Cretaceous hybodont shark!,[8110736]
199,Our latest paper  Ontogenetic growth trends in two marine Antarctic bivalves  implications for sclerochronology,[8116728]
200,Analysis of ontogenetic growth trends in two marine Antarctic bivalves  Implications for sclerochronology,[8116728]
201,Analysis of ontogenetic growth trends in two marine  Antarctic  bivalves via    MolluscMonday  OA,[8116728]
202,Read the full research here  free   h/t Journal of Vertebrate Paleontology and,[4980975]
203,Oceanography OS  ,[8120829]
204,OS High resolution monitoring of marine protists based on an observation strategy integrating automated on board ,[8120949]
205,Oceanography OS  High resolution monitoring of marine protists based on an observation strategy integrating autom,[8120949]
206,"It's finally out! Brooks et al   including me!  Chironomid-IT summer temperatures for the LGIT, WC Scotland",[8125563]
207,Chironomid C recon  LGIT Research from my time   and      Quaternary Sci,[8125563]
208,Chironomid inferred summer temperatures for the Last GlacialInterglacial,[8125563]
209,Chironomid C recon  LGIT Research from my time   and      Quaternary Sci    ,[8125563]
210,"Brooks et al , 2016 JQS  Lateglacial Chironomid-inferred summer temps from Muir Park Reservoir, Scotland",[8125563]
211,Flood basalty stuff in China  -,[4235613]
212,That baby Chasmosaurus really is a beautiful specimen,[4980975]
213,Oceanography OS  ,[8127259]
214,OS A Hybrid Variational-Ensemble data assimilation scheme with systematic error correction for limited area ocean,[8127887]
215,Oceanography OS  A Hybrid Variational-Ensemble data assimilation scheme with systematic error correction for limi,[8127887]
216,Zonal currents in the F region deduced from Swarm constellation measurements,[8134575]
217,New ICTJA paper  Late Holocene vegetation and fire dynamics on the summits of the Guayana,[8148046]
218,"Micropalaeontology of Pliocene and  Quaternary palaeoenvironments in S  Albemarle Embayment, N  Carolina, US  ",[8208653]
219,"New paper out on the micropaleontologic record of Pliocene and Quaternary paleoenvironments in North Carolina, USA",[8208653]
220,"New paper out on the micropaleontologic record of Pliocene and Quaternary paleoenvironments in North Carolina, USA htt",[8208653]
221,Oceanography OS  ,[8225487]
222,Glad to see this little beauty is out today   babydinosaur,[4980975]
223,New online  A new non-parasemionotiform order of the Halecomorphi from the Middle Triassic,[8241470]
224,BRITICE open access paper in  QRA Journal of Quaternary Science on Wiley Online Library,[8255730]
225,New late Oligocene Riversleigh crocodile with extreme mandibular constriction    - v,[8274225]
226,  Sulphur-rich v,[8285793]
227,New paper  ,[8285793]
228,New paper finds ,[8285793]
229,Sulphur-rich  VolcanicEruptions triggered extreme  hydrological ev/   re  Geoengineering  climate  science  debate,[8285793]
230,Sulphur-rich  VolcanicEruptions triggered extreme  hydrological ev/   re  Geoengineering  climate,[8285793]
231,Baby Chasmosaurus from Dinosaur Provincial Park to brighten our  FossilFriday,[4980975]
232,++Sulphur eruptions correlate w precip/flood in W Europe/reduced rain intensity central/north Di Salvo ClimPast  j,[8285793]
233,Sulphur-rich  VolcanicEruptions triggered extreme  hydrological ev/    re  Geoengineering  climate  science  debate,[8285793]
234,    Explaining unusual patterns of disarticulation and loss of completeness in fossil vertebrates,[8297351]
235,A new good taphonomy study  paleontology,[8297351]
236,Stick n peel  Explaining unusual patterns of disarticulation and loss of completeness in fossil vertebrates,[8297351]
237,"From    ""Stick 'n' peel""  Explaining unusual patterns of disarticulation and loss of com     ucdresearch",[8297351]
238,Oceanography OS  Multi-sensor in situ observations to resolve the sub-mesoscale features in the stratified Gulf o,[8308528]
239,"OS Multi-sensor in situ observations to resolve the sub-mesoscale features in the stratified Gulf of Finland, Bal",[8308528]
240,OS Current temporal asymmetry and the role of tides  Nan-Wan Bay vs  the Gulf of Elat,[8311569]
241,Oceanography OS  Current temporal asymmetry and the role of tides  Nan-Wan Bay vs  the Gulf of Elat,[8311569]
242,"Eotrachodon, primitive hadrosaurid from southeastern North America and the origin and  early evolution of duck-bills",[4989111]
243,"""Cutting edge science from CubeSats! Woohoo!""  AGUpubs",[8319691]
244,  Climate trends in northern,[8362937]
245,New paper  ,[8362937]
