,body,cites_papers
488,"Zawalna-Geer et al  JQS  Extracting a primary Holocene crytoptephra record from Pupuke maar sediments, Auckland, NZ",[9093502]
489,New  DEVORA finding  Auckland is four times more likely to be affected by ash fall than previously thought    Dr,[9093502]
490,CP The climate of the Mediterranean basin during the Holocene from terrestrial and marine pollen records  A model,[9096353]
491,The climate of the Mediterranean basin during the Holocene from terrestrial and marine pollen records  A model/data,[9096353]
492,New paper  The climate of the Mediterranean basin during the Holocene from terrestrial and marine pollen reco,[9096353]
493,The climate of the Mediterranean basin during the Holocene from terrestrial and marine pollen records  A model/data htt,[9096353]
494,OS An atmosphere-wave regional coupled model  improving predictions of wave heights and surface winds in the Sout,[9097549]
495,Oceanography OS  An atmosphere-wave regional coupled model  improving predictions of wave heights and surface win,[9097549]
496,If anyone else wants to chuck one my way I'll love you forever and stuff,[4992608]
497,"New online  New eomysticetid from Oligocene Kokoamu Greensand, NZ and  review of Eomysticetidae",[9117166]
498,A new eomysticetid from New Zealand and  a review of the Eomysticetidae by    great work Bobby and  Ewan!,[9117166]
499,A new eomysticetid from New Zealand and  a review of the Eomysticetidae by    great work Bo,[9117166]
500,"Introducing Matapa waihao - newly named eomysticetid baleen whale, Oligo , New Zealand 1/N",[9117166]
501,"Introducing Matapa waihao - newly named eomysticetid baleen whale, Oligo , New Zealand 1/N ",[9117166]
502,"New online  New eomysticetid from Oligocene Kokoamu Greensand, NZ and  review of Eomysticetidae ht",[9117166]
503,Read  's recent paper abt a new eomysticetid whale!  WhaleWednesday Abstract at,[9117166]
504,Read  's recent paper abt a new eomysticetid whale!  WhaleWednesday Abstract at  htt,[9117166]
505,"Well I've done my bit  80+ taxa, ~360 characters-from Boessenecker and  Fordyce 2016",[9117166]
506,"Genesis of Cryogenian Datangpo, S  China Mn deposit  Hydrothermal influence and  post-glacial ventilation  ",[9153990]
507,Oceanography OS  Spatial scales of temperature and salinity variability estimated from Argo observations,[4993272]
508,OS Upwelling characteristics in the Gulf of Finland  Baltic Sea  as revealed by Ferrybox measurements in 20072013,[9158256]
509,Oceanography OS  Upwelling characteristics in the Gulf of Finland  Baltic Sea  as revealed by Ferrybox measuremen,[9158256]
510,The Fezouata Biota  An exceptional window on Cambro-Ordovician faunal transition  ,[9205401]
511,New  Lefebvre et al in press  The Fezouata Biota  An exceptional window on the Cambro-Ordovician faunal transition,[9205401]
512,New online  The first coleoid cephalopods from the Upper Cenomanian of Sicily,[9210240]
513,1st coleoid from U  Cenomanian of Sicily and  phylogenetic position of Palaeololiginidae    - v,[9210240]
514,P-T evolution of Bivalvia  Extinction-recovery patterns linked to ecologic and  taxonomic selectivity  ,[9216017]
515,Permo-Triassic taxonomic and ecologic extinction and  recovery in bivalves by   and  colleagues,[9216017]
516,P/Tr evolution of the Bivalvia  Extinction-recovery patterns linked to ecologic and taxonomic selectivity,[9216017]
517,Stable isotope ecology of Hippotherium from Late Miocene Pannonian Basin system  ,[9216018]
518,OS Spatial scales of temperature and salinity variability estimated from Argo observations,[4993272]
519,OS Observed El Nio conditions in the eastern tropical Pacific in October 2015,[9217253]
520,Oceanography OS  Observed El Nio conditions in the eastern tropical Pacific in October 2015,[9217253]
521,Oceanography OS  Modelling wavecurrent interactions off the east coast of Scotland,[9242080]
522,OS Modelling wavecurrent interactions off the east coast of Scotland,[9242080]
523,Mathematicians develop model for predicting coastal storm damage in the North Sea,[9242080]
524,study describes new system for predicting storm damage by waves in areas of the North Sea,[9242080]
525,New online  Phylogenetic position of Corydasialidae  Insecta  Neuropterida revisited,[9242673]
526,Phylogeny of Corydasialidae revisited based on new fossil in Cretaceous amber of Myanmar    - v,[9242673]
527,"Significant new fossil of the Corydasialidae family Cretaceous amber, Myanmar  FossilFriday",[9242673]
528,"Significant new fossil of the Corydasialidae family Cretaceous amber, Myanmar  FossilFriday htt",[9242673]
529,"Submarine palaeoenvironments during Emeishan flood basalt volcanism, SW China",[4235613]
530,New CP discussion  An interactive tool for navigation within a database of water and carbon stable isotope rec,[4993825]
531,Phylogenetic position of Corydasialidae  Neuropterida  revisited based on new fossil in Cretaceous amber of Myanmar,[9242673]
532,OS Technical note  GODESS  a profiling mooring in the Gotland Basin,[9270330]
533,Oceanography OS  Technical note  GODESS  a profiling mooring in the Gotland Basin,[9270330]
534,The rise of jaws  new evidence of Devonian jawed ammonoids,[9271085]
535,New  Klug et al in press  Oldest Gondwanan cephalopod mandibles  Late Devonian  and the mid-Palaeozoic rise of jaws,[9271085]
536,"   The oldest Gondwanan cephalopod mandibles  Hangenberg Black Shale, Late",[9271085]
537,"The oldest Gondwanan cephalopod mandibles  Hangenberg Black Shale, Late",[9271085]
538,Devonian  ammonoid mandibles and the mid-Palaeozoic rise of jaws,[9271085]
539,The rise of jaws  new evidence of Devonian jawed ammonites,[9271085]
540,When did ammonites first get Jaws? 400 million years ago,[9271085]
541,CP An interactive tool for navigation within a database of water and carbon stable isotope records from natural a,[4993825]
542,"The oldest Gondwanan cephalopod mandibles  Hangenberg Shale, Late Devonian  and the mid-Palaeozoic rise of jaws",[9271085]
543,"Oceanography OS  Sub-basin scale sea level budgets from satellite altimetry, Argo floats and satellite gravimetry",[9274592]
544,"OS Sub-basin scale sea level budgets from satellite altimetry, Argo floats and satellite gravimetry in the North ",[9274592]
545,"Henrot, A -J -",[9298243]
546,"New paper says Miocene climate is ""difficult to reproduce"" in climate models",[9298243]
547,Hard to model 4000 ppm CO2 in models that only have CO2 move,[9298243]
548,"New Palaeogene embrithopod fossils from Turkey, ungulate evolution and  biogeography",[9520366]
549,Could embrithopods be non-afrotherians? The inclusion of species level OTUs in a broader matrix might suggest this,[9520366]
550,"Late Devonian reefs and  microbialite in, S  Guizhou, S  ChinaImplications for palaeoenvironment  ",[9545017]
551,Stratigraphic context of E  Cretaceous and  ?Jurassic-Cretaceous of Sihetun area  NE China  from 3 continuous cores  ,[9545018]
552,An interactive tool for navigation within a database of water and carbon stable isotope records from natural,[4993825]
553,"Mixed Ediacaran-metazoan assemblage from Zaris Sub-basin, Namibia  ",[9563789]
554,"""""  paleo 2/3",[9563789]
555,Ecosystems made up of Ediacara fauna and  metazoans found that predate  Cambrian explosion,[9563789]
556,"In the first world war between multicellular organisms 550 million years ago,  bilateral symmetry won -",[9563789]
557,Bee cell trace fossils associations on paleosols from Santa Cruz Formation  Palaeoecological and  implications  ,[9563790]
558,CP Boreal fire records in Northern Hemisphere ice cores  A review,[9565464]
559,Boreal fire records in Northern Hemisphere ice cores  A review,[9565464]
560,Boreal fire records in Northern Hemisphere ice cores  A review  Boreal fire records in Northern Hemisphere ic,[9565464]
561,Boreal fire records in Northern Hemisphere ice cores  A review  discussionpaper,[9565464]
562,Clear morphological disparity of appendicular skeletal traits quantified across fish-tetrapod transition,[4993897]
563,Another new discussion paper from  IPICS2016 - Boreal fire records in Northern Hemisphere ice cores  A review -,[9565464]
564,New paper  Boreal fire records in Northern Hemisphere ice cores  A review,[9565464]
565,CP The simulated climate of the Last Glacial Maximum and insights into the global carbon cycle,[9578794]
566,The simulated climate of the Last Glacial Maximum and insights into the global carbon cycle,[9578794]
567,CPD - The simulated climate of the Last Glacial Maximum and insights into the global carbon cycle,[9578794]
568,New paper  The simulated climate of the Last Glacial Maximum and insights into the global carbon cycle,[9578794]
569,The simulated climate of the Last Glacial Maximum and insights into the global carbon cycle  OA,[9578794]
570,"""The simulated climate of the Last Glacial Maximum and insights into the global carbon cycle"" discuss away here",[9578794]
571,"Oceanography OS  First year of the new Arctic AWIPEV-COSYNA cabled Underwater Observatory in Kongsfjorden, Spitsb",[9625818]
572,Comparable disparity in the appendicular skeleton across the  fish tetrapod transition,[4993897]
573,CP The 1816 year without a summer in an atmospheric reanalysis,[9625866]
574,The 1816 year without a summer in an atmospheric reanalysis-Expliclty links impacts to Tambora Brohan ClimPast  j,[9625866]
575,The 1816 year without a summer in an atmospheric reanalysis-Expliclty links impacts to Tambora Brohan ClimPast,[9625866]
576,New paper  The 1816 year without a summer in an atmospheric reanalysis,[9625866]
577,A new way to do severe weather event attribution - use a GCM assimilating surface pressures,[9625866]
578,"The severe weather of 1816 was mostly a local circulation change, attributable to the Tambora eruption",[9625866]
579,The 1816 year without a summer in an atmospheric reanalysis  discussionpaper,[9625866]
580,"1816  ""very cold and  wet summer devastated ag  in Europe and  NA, causing widespread food shortages, unrest and  suffering""",[9625866]
581,Atmospheric reanalysis is possible for more than just the satellite era - we've done 1816,[9625866]
582,The 1816 year without a summer in an atmospheric reanalysis,[9625866]
583,"""Decoding the oxygen isotope signal for seasonal growth patterns in Arctic bivalves""",[4994254]
584,The 1816 year without a summer in an atmospheric reanalysis at,[9625866]
585,OS GEM  A Dynamic Tracking Model for Mesoscale Eddies in the Ocean,[9649352]
586,Oceanography OS  GEM  A Dynamic Tracking Model for Mesoscale Eddies in the Ocean,[9649352]
587,"CP Sea ice-related halogen enrichment at Law Dome, coastal East Antarctica",[9658179]
588,"Sea ice-related halogen enrichment at Law Dome, coastal East Antarctica",[9658179]
589,"New paper  Sea ice-related halogen enrichment at Law Dome, coastal East Antarctica",[9658179]
590,North Atlantic Oscillation controls on oxygen and hydrogen isotope gradients in winter precipitation across E,[9675314]
591,CP North Atlantic Oscillation controls on oxygen and hydrogen isotope gradients in winter precipitation across Eu,[9675314]
592,CPD - North Atlantic Oscillation controls on O and  H isotope gradients in winter precipitation across Europe,[9675314]
593,North Atlantic Oscillation controls on oxygen and hydrogen isotope gradients in winter precipitation across Europe ,[9675314]
594,Paper by Vihtakari et al  about Decoding the oxygen isotope signal for seasonal growth patterns in Arctic bivalves,[4994254]
595,New paper  North Atlantic Oscillation controls on oxygen and hydrogen isotope gradients in winter precipitati,[9675314]
596,"Stalagmite  Belize connections between major dry events, overall  climate variability and   Maya sociopolitical changes",[9685450]
597,"extended record from stalagmite MC01, Belize, connections between dry events, clim var, and  Maya sociopolitics",[9685450]
598,New paper finds multiple severe droughts in Belize over past 5000 years  NotCO2Related,[9685450]
599,Geomagnetic storms are stronger when it's daytime over the Americas,[9694292]
600,EMU Prof  Roxanne Katus offers new insight on storm progression during magnetic storms  Full article,[9694292]
601,The thermal structure and energy balance of the mesosphere is dominated by The Sun   AGWisRubbish,[9713569]
602,A new Macrosemiidae  Neopterygii  from the U J Solnhofen Archipelago and  Cerin  FossilFriday,[9732960]
603,"Palaeomacrosemius thiollieri,gen  and  sp  nov , Macrosemiidae from German and  French U  Jurassic    - v",[9732960]
604,A new Macrosemiidae  Neopterygii  from the U J Solnhofen Archipelago and  Cerin  FossilFriday ,[9732960]
605,batescollege William Ambrose in Biology writes on growth patterns in Arctic bivalve mollusks,[4994254]
606,"Early Eocene fish fauna from Bitter Creek area of Wasatch Formation of S W  Wyoming, U S A     - v",[9788594]
607,"An early Eocene fish fauna from the Bitter Creek area of the Wasatch Formation of southwestern Wyoming, U S A",[9788594]
608,"An Early Eocene Fish Fauna from the Bitter Creek Area of the Wasatch Formation of Southwestern Wyoming, U S A",[9788594]
609,New article by Andrs S  Rigual-Hernndez and  colleagues on Sediment trap vs surface sediment assemblages,[9797303]
610,New paper by Julieta Martinelli and  colleagues on dead shell assemblages,[9797305]
611,"Our study found that the  megafauna had disappeared from  MargaretRiver WA by about 40,000 years ago 2/2",[9810923]
612,"Our study found that the  megafauna had disappeared from  MargaretRiver WA by about 40,000 years ago",[9810923]
613,"Late Quaternary vertebrate deposit in Kudjal Yolgah Cave, Australia  refining regional late Pleistocene extinctions",[9810923]
614,New megafauna paper - a Flinders Uni collaboration,[9810923]
615,hal-01345520  Choppy wave model for nonlinear gravity waves,[9846293]
616,batescollege Will Ambrose researches seasonal growth of Arctic bivalves as an archive for environmental change,[4994254]
617,"We've tried more quantitative comparisons of different reconstruction types, but only back to 1800",[9851486]
618,"New pub  Matapanui, replacement name for our unfortunately named eomysticetid Matapa waihao",[9870074]
619,"O isotopes and  high-magnitude, abrupt Lateglacial Interstadial Scottish climate events    - v",[9871574]
620,New  Exploring phylogenetic relationships of Pteraspidiformes heterostracans using continuous and  discrete characters,[9911057]
621,New  Exploring phylogenetic relationships of Pteraspidiformes heterostracans using continuous and  discrete characters htt,[9911057]
622,Phylogeny of Pteraspidiformes heterostracans using continuous discrete characters  OA  - v   -,[9911057]
623,"Its  PteraspidTuesday, so get reading this new paper by   and",[9911057]
624,phylogeny of Pteraspidiformes heterostracans  stem-gnathostomes  using continuous and discrete characters,[9911057]
625,How do you make phylogenetic sense of fossil jawless fish?   New paper on heterostracans in,[9911057]
626,How do you make phylogenetic sense of fossil jawless fish?   New paper on heterostracans in   ,[9911057]
627,"Systematic reassessment of an agriochoerid oreodont from the Hancock Mammal Quarry, Clarno  Eocene , Oregon",[4995129]
628,Open Access UCL Research  Substructures within a Dipolarization Front Revealed by High-temporal Resolution,[9924000]
629,OS Comparison of the simulated upper-ocean vertical structure using 1-dimensional mixed-layer models,[9948500]
630,Oceanography OS  Comparison of the simulated upper-ocean vertical structure using 1-dimensional mixed-layer models,[9948500]
631,Qin et al   2016  investigating the accuracy of 135 6-nm inversion methodologies has been published in JGR,[9956477]
632,  NERCpapers,[9983911]
633,Quantitative analysis of the ecological dominance of benthic disaster taxa in the aftermath of the end-Permian,[10000143]
634,Response of calcareous nannoplankton to the Late Cretaceous Oceanic Anoxic Event 2 at Oued Bahloul  C  Tunisia   ,[10000282]
635,Anoxia controlled by relative sea-level changes  An example from the Mississippian Barnett Shale Formation  ,[10000285]
636,"Oceanography OS  Accessing diverse data comprehensively   CODM, the COSYNA data portal",[10044671]
637,"OS Accessing diverse data comprehensively   CODM, the COSYNA data portal",[10044671]
638,Paper is here,[4330888]
639,"Well, it finally happened  Meaghan is now a published author  Woot!",[4995129]
640,OS Observed and simulated full-depth ocean heat-content  changes for 19702005,[10044827]
641,Oceanography OS  Observed and simulated full-depth ocean heat-content  changes for 19702005,[10044827]
642,OS - Abstract - Observed and simulated full-depth ocean heat-content changes for 19702005,[10044827]
643,planetary energy imbalance that is primarily manifested by increasing ocean heat content   OHC   climatechangfe,[10044827]
644,Climate models closely track ocean heat observations  Red  pred  vs black  obs  dashed lines,[10044827]
645,Climate models closely track ocean heat observations  Red  pred  vs black  obs  dashed lines ,[10044827]
646,"Climatechange modelling works, new study on  ocean temp Author J Abraham",[10044827]
647,A new study has found strong agreement between  climate models and recent ocean warming,[10044827]
648,"Now recognized ""OHC fundamental metric for climate model validation and  evaluation""  FINALLY!",[10044827]
649,"Now recognized ""OHC fundamental metric for climate model validation and  evaluation""",[10044827]
650,"Systematics of an agriochoerid oreodont from Hancock Mammal Quarry, Clarno, Oregon     - v",[4995129]
651,Enough CO2 does also to already chang pH of Earths oceans   Well know warm when oceans cant absorb CO2 anymore,[10044827]
652,climatechange,[10044827]
653,93% of heat trapped by Greenhouse Gases ends up in the Oceans,[10044827]
654,Observed and simulated full-depth ocean heat-content  changes for 19702005,[10044827]
655,Fancy reading this?,[10044827]
656,happy? Your turn,[10044827]
657,These may be of interest  1  '16 2  '16 3  '14,"[15342266,2753313,10044827]"
658,"Okay, so if I link you to a model which has been 100% accurate like, say, this one  then that counts?",[10044827]
659,"Well, according to this peer-reviewed paper, the models are actually pretty reliable",[10044827]
660,"I not to give complex answers via twitter, but reference more scholarly research",[10044827]
661,Alexandronectes zealandiensis a new plesiosaur from lower Maastrichtian of New Zealand    - v,[4996107]
662,"sorry, you are completely wrong",[10044827]
663,"If asking a good-faith question, this is a starting point   If trying to make science look silly, don't bother",[10044827]
664,"Second one within 10 seconds of Googling since Ben's crowd loves ""facts not feelings""",[10044827]
665,Finally  You want to discuss SCIENCE!,[10044827]
666,Oh this,[10044827]
667,"OS Aragonite saturation states and pH in western Norwegian fjords  seasonal cycles and controlling factors, 2005",[10049454]
668,Oceanography OS  Aragonite saturation states and pH in western Norwegian fjords  seasonal cycles and controlling ,[10049454]
669,Voluntary measurements of container ships help to monitor  oceanacidification and temperature in fjords of  Norway,[10049454]
670,"Aragonite saturation states and pH in western Norwegian fjords  seasonal cycles and controlling factors, 20052009",[10049454]
671,"OS Developing European operational oceanography for Blue Growth, climate change adaptation and mitigation, and ec",[10049455]
672,New  plesiosaur from New Zealand  Alexandronectes  paleontology,[4996107]
673,"Oceanography OS  Developing European operational oceanography for Blue Growth, climate change adaptation and miti",[10049455]
674,"The Imager for Sprites and  Upper Atmospheric Lightning  ISUAL , Frey, Journal of Geophysical Research  Space Physics,",[10050540]
675,"The Imager for Sprites and  Upper Atmospheric Lightning  ISUAL , Frey, Journal of Geophysical Research  Space Physics, ht",[10050540]
676,Dzisiaj przypominam misj  FormoSat-2  ISUAL  The Imager for Sprites and Upper Atmospheric Lightning,[10050540]
677,"Palaeoenvironmental analysis of Neotropical fossil mammal site of Cerdas, Bolivia  middle Miocene   ",[10064523]
678,"Always wondered about the paleoenvironment of Cerdas, Bolivia? Who hasn't?! Wonder no more!",[10064523]
679,"FossilFriday Bolivian Miocene rhizoliths, recently described  +more  by   in PPP",[10064523]
680,CPD  discussionpaper ,[10067994]
681,CPD - ,[4996835]
682,  Deforestation decreases res,[10067994]
683,New paper  ,[10067994]
684,"Easter Island deforestation didn't just muck with ecosystem, it may have altered island's climate Paper in",[10067994]
685,"New late Hemingfordian vertebrate fauna from Oregon, and  its biostratigraphy and  geochronology    - v",[10073416]
686,And I'm published in   JVP!,[10073416]
687,"FossilFriday   new late Hemingfordian vertebrate fauna from Hawk Rim, OR",[10073416]
688,CP An improved North-South synchronization of ice core records around the 41 K beryllium 10 peak,[10084297]
689,An improved North-South synchronization of ice core records around the 41 K beryllium 10 peak,[10084297]
690,An improved North-South synchronization of ice core records around the 41 K beryllium 10 peak  An improved No,[10084297]
691,CPD  discussionpaper An improved North-South synchronization of ice core records around the 41 K beryllium 10 peak,[10084297]
692,New CP discussion  ,[4996835]
693,New paper  An improved North-South synchronization of ice core records around the 41 K beryllium 10 peak,[10084297]
694,"Geografia Article de Graham Mortyn a ""Palaeogeography, Palaeoclimatology, Palaeoecology""",[10084887]
695,New insights into E  Pliocene hydrographic dynamics and  their relationship to climatic evolution of Mediterranean  ,[10084887]
696,"Geografa  UAB Article de Graham Mortyn a la revista ""Palaeogeography, Palaeoclimatology, Palaeoecology""",[10084887]
697,Jurassic pleuropholid fish in Tethys Sea domain of N  America    - v,[10085783]
698,New genus of Sigmodontinae from Pliocene of C  Argentina    - v,[10085785]
699,"A new genus of Sigmodontinae  Mammalia, Rodentia, Cricetidae  from the Pliocene of central Argentina",[10085785]
700,Biostratigraphy and  palaeoecology of Lower Ordovician graptolites from Fezouata Shale  Moroccan Anti-Atlas   ,[10112447]
701,IGEOinvestiga Biostratigraphy and palaeoecology of Lower Ordovician graptolites from the Fezouata Shale,[10112447]
702,Early Permian coastal flora dominated by Germaropteris martinsii from basinal sediments in W  Texas  ,[10129532]
703,OS Freshening of Antarctic Intermediate Water in the South Atlantic Ocean in 20052014,[10173258]
704,Oceanography OS  Freshening of Antarctic Intermediate Water in the South Atlantic Ocean in 20052014,[10173258]
705,"Ontogeny of Furongian trilobiteProceratopyge from Antarctica, and  metamorphosis in trilobites    - v",[10185862]
706,New study in  Palaeontology examines the evolution of metamorphosis in trilobites,[10185862]
707,Metamorphosis in Furongian trilobites from Victoria Land Antarctica  TrilobiteTuesday,[10185862]
708,"Latest Pleistocene and  Holocene glacial events in Colonia valley, N  Patagonia Icefield, S  Chile - v",[10202870]
709,  Freshening of the Labrador Sea as,[10208261]
710,CPD  discussionpaper - ,[10208261]
711,New paper  ,[10208261]
712,Oceanography OS  ,[10213181]
713,Changes in extreme regional  sea level under global  warming  climatechange,[10213181]
714,"Meet Awamokoa tokarahi, a new basal dolphin from the late Oligocene of New Zealand",[10233533]
715,FossilFriday Skull of newly described late Oligocene marine dolphin from New Zealand,[10233533]
716,"New online  Awamokoa tokarahi, a new basal dolphin in the Platanistoidea  late Oligocene, New Zealand",[10233533]
717,"Awamokoa tokarahi, a new basal dolphin in the Platanistoidea  late Oligocene, New Zealand",[10233533]
718,CPD - Dynamical downscaling of the WN Pacific from CCSM4 during the LGM and late 20th century using the WRF model,[4996840]
719,"New paper with   Biotic invasion, niche stability and the assembly of regional biotas",[10252343]
720,"Biotic Invasion, Niche Stability, and the Assembly of Regional Biotas in Deep Time",[10252343]
721,Congrats! by,[10278661]
722,  North American regi,[10283113]
723,New paper  ,[10283113]
724,Resolution of E  Jurassic actinopterygian fishPachycormus and  dispersal of Pachycormiformes    - v,[10311597]
725,"Apologies for the delay, recent content indexing is still loading  the article can be found at",[10311597]
726,Resolution of the Early Jurassic actinopterygian fish Pachycormus and a dispersal hypothesis for Pachycormiformes,[10311597]
727,New CP discussion  Dynamical downscaling of the western North Pacific from CCSM4 simulations during the last g,[4996840]
728,Resolution of the Early Jurassic actinopterygian fish Pachycormus and a dispersal hypothesis for Pachycormiformes  ,[10311597]
729,"Stratigraphic and  13C of P-C CO3s, S  China and  late Palaeozoic icehouse climate and  icehouse-greenhouse transition  ",[10311600]
730,Astronomical cycles of M  Permian of S  China and  their implications for sequence stratigraphy and  palaeoclimate  ,[10324740]
731,"New paper show how astronomical cycles controlled climate of the Permian, NOT CO2",[10324740]
732,"heliocentric      New paper show how astronomical cycles controlled climate of the Permian, NOT CO2",[10324740]
733,Clay mineralogy at P-T Shangsi section and  their palaeoenvironmental and /or palaeoclimatic significance  ,[10324742]
734,How useful is the Similarity Distance Decay relationship for fossils? An ammonite case study,[10374439]
735,How useful is the Similarity Distance Decay relationship for fossils? An ammonite case study ,[10374439]
736,Article out i reviewed on Gauging scale and biogeographical signals in ammonite similarity distance decay analyses,[10374439]
737,A Multi-disciplinary Perspective on Habitat Preferences among Dinosaurs in a Cretaceous Arctic Greenhouse World,[4330888]
