,body,cites_papers
487,Indonesian domestic workers and the unmaking of transnational livelihoods and provisional futures migration,[7584254]
488,Indonesian domestic workers and the unmaking of transnational livelihoods and provisional futures,[7584254]
489,Hanging Out With the Right Crowd Peer Influence on Risk-Taking Behavior in Adolescence - Hoorn,[8079310]
490,Hanging Out With the Right Crowd Peer Influence on Risk-Taking Behavior in Adolescence,[8079310]
491,Study shows - again - teens risk more when peers are present adolescence,[8079310]
492,OK!,[8115626]
493,Hendrikx and Wissink offer an exploratory study of service accessibility in commodity housing estates in Guangzhou,[8127133]
494,"Fresh look at 'club goods', access and housing estates in Guangzhou, Dept of Public Policy, Uni Hong Kong",[8127133]
495,"Memory is the strength of our resistance beautiful academic article about San Jos Peace Community, Colombia",[8252150]
496,"Memory is the strength of our resistance beautiful academic article about San Jos Peace Community, Colombia ",[8252150]
497,Chris Courtheyn   explores an other politics through embodied and material commemoration in Colombia,[8252150]
498,What happens when you let a cultural geographer go rock climbing?,[8268982]
499,The production of climbing space,[8268982]
500,Some new sonic geographies from   in cultural geographies,[8285448]
501,I have a new paper early online in Cultural Geographies on 'Sonic affects and the production of space'  here $,[8285448]
502,I have a new paper early online in Cultural Geographies on 'Sonic affects and the production of space'  here,[8285448]
503,"Another rigorous, critical paper by   on the sonic production of space between micropolitical and macropolitical",[8285448]
504,"Another rigorous, critical paper by   on the sonic production of space between micropolitical and macropolitical h",[8285448]
505,Adrian Mulligan traces the travels of the American abolitionist Frederick Douglass in the Irish Atlantic World,[8315383]
506,"levers and fulcrums - Frederick Douglass and the forgotten world of Irish abolitionist activity, geog, bucknell uni",[8315383]
507,"levers and fulcrums - Frederick Douglass and the forgotten world of Irish abolitionist activity, geog, bucknell uni ",[8315383]
508,MotherAdolescent Proficiency in a Common Language Facilitates Socialization Among,[8367950]
509,MotherAdolescent Proficiency in a Common Language Facilitates Socialization Among Mexican-Origin Families,[8367950]
510,Here's what's trending on social media from JRA,[8367950]
511,Prof Rand Conger et al on how language affects socialization in Mexican-American families,[8367950]
512,Prof Rand Conger et al on how language affects socialization in Mexican-American families   ,[8367950]
513,"Another new paper, from Rebecca Wheeler of  , on sense of place in rural England",[8376712]
514,"Another new paper, from Rebecca Wheeler of  , on sense of place in rural England ",[8376712]
515,What is 'mobile' nostalgia? Exciting new article on rural England by Rebecca Wheeler,[8376712]
516,What is 'mobile' nostalgia? Exciting new article on rural England by Rebecca Wheeler    ,[8376712]
517,Geographers matter! Doreen Massey 19442016,[8438150]
518,writes a thoughtful obituary for Doreen Massey in   Geography,[8438150]
519,"Good obit by   of Doreen Massey, whom I knew as a fellow Hon Vice President of Geographical Assoc",[8438150]
520,"Good obit by   of Doreen Massey, whom I knew as a fellow Hon Vice President of Geographical Assoc   ",[8438150]
521,Geographers matter! a tribute to Doreen Massey by our founding editor   is now free to download,[8438150]
522,A really decent tribute from   for the late Doreen Massey,[8438150]
523,Geographers matter! Doreen Massey 19442016  Social and Cultural Geography OA,[8438150]
524,Geographers matter! Doreen Massey 19442016 place space feministgeography,[8438150]
525,Read Alison's article on globalisation following the unfollowable trail of the commodity,[8527902]
526,Doubleplusgood duckspeak,[8527902]
527,Distant screaming into the abyss,[8527902]
528,This is the worst one yet  The author isn't even pretending,[8527902]
529,This person somehow has a PhD,[8527902]
530,A straw man in the marchforscience debates or an exemplar?,[8527902]
531,help,[8527902]
532,"""Thing-following in an age of early globalisation""   Uhm",[8527902]
533,This is some of the worst writing I've ever seen,[8527902]
534,The thing is,[8527902]
535,Ok this thing is the worst piece of writing I've ever seen except for art criticism,[8527902]
536,Bidirectional Relationships Between Parenting Processes and Deviance in a Sample of Inner-City,[8532491]
537,Bidirectional Relationships Between Parenting Processes and Deviance Inner-City Black Youth a HT,[8532491]
538,Patterns of Adolescent Regulatory Responses During Family Conflict and Mental Health,[8532493]
539,Patterns of Adolescent Regulatory Responses During Family Conflict and Mental Health Trajectories,[8532493]
540,How family conflict distresses teens,[8532493]
541,New article by   on the politicaleconomy of 'flex trees' Available here,[8644100]
542,Roles of Response Inhibition and GeneEnvironment Interplay in Pathways to Adolescents',[8644592]
543,Roles of Response Inhibition and GeneEnvironment Interplay in Pathways to Adolescents' Externalizing Problems,[8644592]
544,"Nadia Bartolini,   and George Revill ask ""what culture for what geography?"" a new provocation",[8645332]
545,New article on genderexclusion and inequality in rural-urban migration in China by Jingzhong Ye et al,[8665607]
546,Left-behind women gender exclusion and inequality in rural-urban migration in China,[8665607]
547,Read the   Grassroots Voices trilogy -- all free to download! Part one 'Left-behind women',[8665607]
548,FREEACCESS to a new Grassroots Voices trilogy on China - Part 1 on left-behind women and gender exclusion,[8665607]
549,Left-behind women gender exclusion and inequality in rural-urban migration in China Free access!,[8665607]
550,Mid-week read   Left-behind women gender exclusion and inequality in rural-urban migration in China,[8665607]
551,FREEACCESS to a new Grassroots Voices trilogy on China - Part 1 on left-behind women and gender exclusion ,[8665607]
552,Externalizing Problem Behavior in Adolescence Parenting Interacting With DAT1 and DRD4 Genes -,[8705143]
553,Externalizing Problem Behavior in Adolescence Parenting Interacting With DAT1 and DRD4 Genes,[8705143]
554,Great day for new  -related papers  's geographies of infant feeding really resonates as a new-ish dad,[8830249]
555,This new paper by   would be a great gcyfrgchat twitter hour paper   -,[8830249]
556,Important new paper by   expands children's geog by looking at feeding and the everyday geographies of infants,[8830249]
557,What might infant geographies look like? Just published   in Social and Cult Geog,[8830249]
558,"OA Food, feeding and the material everyday geographies of infants possibilities and potentials",[8830249]
559,exciting new insights into materialgeographies of infant feeding,[8830249]
560,"My latest ""Who catches the biotech train? Understanding diverging political responses to GMOs in Southeast Asia""",[8922559]
561,newarticle by   on understanding diverging political responses to GMOs in SoutheastAsia Available here,[8922559]
562,newarticle by   on understanding diverging political responses to GMOs in SoutheastAsia Available here h,[8922559]
563,Technology-Based Communication and the Development of Interpersonal Competencies Within,[8941836]
564,Teens who text and use social media too much develop poor romantic relationship skills?,[8941836]
565,"The more teens talk to their partners via tech vs IRL/phone, the worse their conflict management skills 1yr later",[8941836]
566,This reporting - doesnt mention that telephone is considered traditional communication,[8941836]
567,Teens using socialmedia can hurt adult love life,[8941836]
568,NEW research from   teens using socialmedia can hurt adult love life,[8941836]
569,"For more information regarding the study, visit Journal of Research on Adolescence",[8941836]
570,"Brian Gleason, a couples therapist and co-author of Exceptional Relationships Transformation Through Embodied",[8941836]
571,Wouter van Gent and Rivke Jaffe examine the role of cinema in spatial imaginaries that normalize urban inequalities,[8946341]
572,"Normalizing urban inequality cinematic imaginaries of difference in postcolonial Amsterdam,",[8946341]
573,"newarticle by Montenegro de Wit on conservation science, plantbreeding and the makings of new seed enclosures",[8951930]
574,newarticle by Goldman et al on access and womensempowerment in Northern Tanzania Available here,[8962853]
575,Our new article-Controlling land they call their own access and women's empowerment in Northern Tanzania,[8962853]
576,"Looks interesting Secularization, sacralization and the reproduction of sacred space in China via",[8969355]
577,"Looks interesting Secularization, sacralization and the reproduction of sacred space in China via  ",[8969355]
578,"In the context of secularization, Ningning Chen explores the industrial use of ancestral temples in rural China",[8969355]
579,"Maillet,   and Williams discuss the challenges of researching migration and enforcement in obscured places",[8969499]
580,"Maillet,   and Williams discuss the challenges of researching migration and enforcement in obscured places ",[8969499]
581,Developmental Trajectories of Nonsuicidal Self-Injury in Adolescence and Psychiatry,[8987580]
582,Developmental Trajectories of Nonsuicidal Self-Injury in Adolescence and Intrapersonal/Interpersonal Risk Facto,[8987580]
583,"Gemma O'Brien considers independent bookshops as slow, socially connective retail",[8993528]
584,Green appropriations through shifting contours of authority and property on a pastoralist commons  The dynamics,[9009794]
585,Laura German is first author on a paper published this May in Journal of Peasant Studies,[9009794]
586,"newarticle by German et al on green appropriations, shifting authority and property on pastoralist commons",[9009794]
587,discusses critical pedagogy and the urgent need for critical reflections on US civil rights movement,[9053393]
588,"New from   Penn State - Fierce urgency, critical pedagogy, USCivilRightsMovement",[9053393]
589,Associations Between School Connection and Depressive Symptoms From Adolescence Through Early Adulth,[9062834]
590,Associations Between School Connection and Depressive Symptoms From Adolescence Through Early Adulthood Modera,[9062834]
591,Interested in Agrarian political economy? Read this FreeAccess article from The Journal of Peasant Studies,[9070077]
592,FreeAccess Agrarian political economy and modern world capitalism the contributions of food regime analysis,[9070077]
593,Some great free downloads from Journal of Peasant Studies  Agrarian political economy and modern world,[9070077]
594,Agrarian political economy and modern world capitalism the contributions of food regime analysis,[9070077]
595,FREEACCESS to the 'Dialogue on Food Regimes' collection has been extended! Read Henry Bernstein's article here,[9070077]
596,FREEACCESS to the 'Dialogue on Food Regimes' collection has been extended! Read Henry Bernstein's article here ,[9070077]
597,Commentary Food regime analysis and agrarian questions widening the conversation ~Harriet Friedmann,[9070445]
598,FREEACCESS to the 'Dialogue on Food Regimes' collection has been extended! Read Harriet Friedmann's article here,[9070445]
599,FREEACCESS to the 'Dialogue on Food Regimes' collection has been extended! Read Harriet Friedmann's article here htt,[9070445]
600,Commentary Food regime analysis and agrarian questions widening the conversation,[9070445]
601,New article by   in Race Ethnicity and Education   racism Romani CzechRepublic,[9098134]
602,My latest article about segregation of Roma in Czech Republic includes references to  's research,[9098134]
603,New article by   in Race Ethnicity and Education   racism Romani,[9098134]
604,"My article about racism and educational segregation of Roma in Race, Ethnicity and Education",[9098134]
605,Institutional racism and segregation of Romani students in the CzechRepublic  Great new article by,[9098134]
606,First 50 visitors will be able to read this great article by   for free! cc,[9098134]
607,First 50 visitors will be able to read this great article by   for free! cc   ,[9098134]
608,Institutional racism and segregation of Romani students in the CzechRepublic  Great new article by   htt,[9098134]
609,"Risky Bodies, Drugs and Biopolitics On Pharmaceutical Governance of Addiction and Other 'Diseases of Risk', S Vrecko",[9099702]
610,"Risky Bodies, Drugs and Biopolitics On Pharmaceutical Governance of Addiction and Other 'Diseases of Risk', S Vrecko  ",[9099702]
611,"New from Scott Vrecko   Risky Bodies, Drugs and Biopolitics On the Pharmaceutical Governance of Addiction",[9099702]
612,"Risky Bodies, Drugs and Biopolitics On the Pharmaceutical Governance of Addiction and Other  bodyandsociety",[9099702]
613,"New from Scott Vrecko   Risky Bodies, Drugs and Biopolitics On the Pharmaceutical Governance of Addiction ht",[9099702]
614,"Interesting new Body and Society piece applying Shildrick's ""the monstrous"" to aging research  agestudies",[9101311]
615,"Queering 'Successful Ageing, Dementia and Alzheimers Research Contributing to both ageing re bodyandsociety",[9101311]
616,"Intersting new article via   - 'Queering ""Successful Ageing"", Dementia and Alzheimer's Research'",[9101311]
617,"Self-promo read our Body and Society article applying Shildrick's ""the monstrous"" to ageing research",[9101311]
618,"Book review William Terry on Meehan and Strauss ""Precarious worlds contested geographies of social reproduction""",[9115100]
619,newarticle by Karine Peschard on seed wars and farmers rights in Brazil and India Available here,[9116535]
620,"Perspectives on farmers' rights from Brazil and India, in the Journal of Peasant Studies",[9116535]
621,newarticle by Ichinkhorloo and Yeh on spatiality and politics in rangeland interventions in Mongolia Read here,[9136518]
622,newarticle by Ichinkhorloo and Yeh on spatiality and politics in rangeland interventions in Mongolia Read here htt,[9136518]
623,Ephemeral communities spatiality and politics in rangeland interventions in Mongolia,[9136518]
624,journal of peasant studies Ephemeral communities spatiality and politics in rangeland interventions in Mongolia,[9136518]
625,journal of peasant studies Ephemeral communities spatiality and politics in rangeland interventions in Mongolia ,[9136518]
626,"newarticle by Harrison and Chiroro on legitimacy, resilience and going beyond the natural in naturaldisasters",[9160466]
627,"newarticle by Harrison and Chiroro on legitimacy, resilience and going beyond the natural in naturaldisasters ",[9160466]
628,Paper published by CIDT's Canford Chiroro in   on differentiated resilience around natural disasters,[9160466]
629,New paper from   me and team re Aust primary school teacher discourses on whiteness and national identity,[9230923]
630,Whiteness and national identity teacher discourses in Australian primary schools,[9230923]
631,"Read ""Dreams of Canadian Students"" involving 600 dream reports in the new issue of JCCP today! Psych CrossCulture",[9240646]
632,"SAGEpsychology Read ""Dreams of Canadian Students"" involving 600 dream reports in the new issue of JCCP today! ",[9240646]
633,A comparison of goal setting and reputational orientations of African adolescents from refugee psychology OA,[9582885]
634,Exploring Repressive Suffering Construal as a Function of Collectivism and Social Morality Prior research de,[9617345]
635,Contexts that discriminate international perspectives on the education of Roma students,[9622920]
636,"Culture Moderates the Relation Between Perceived Stress, Social Support, and Mental and Physical Health",[9636290]
637,newarticle by Sbastien Bainville on landrights and agrarian systems research in BurkinaFaso Available here,[9853784]
638,Unauthorized Status and Youth Development in the United States Consensus Statement of the Society f,[9860152]
639,Unauthorized Status and Youth Development in the United States Consensus Statement of the Society for Research,[9860152]
640,Unauthorized status and youth development in the US Consensus statement of the society for research in Adolescence,[9860152]
641,Unauthorized status and youth development in the US Consensus statement of the society for research in Adolescence ,[9860152]
642,Unauthorized Status and Youth Development in the United States Consensus Statement of the Society for Research ,[9860152]
643,How does having unauthorized immigrant parents impact children psychologically? Recent report surveys evidence,[9860152]
644,Refugees and child development thx for sharing,[9860152]
645,Mattias Krrholm compares the changing temporality of territorial appropriation in Malm's main square over time,[9860778]
646,"Or this, on temporality and territory in Malmo, Sweden NGM2017",[9860778]
647,Mark Griffiths and Eleanor Brown explore the embodied experiences of recently returned international volunteers,[9860922]
648,"Oh and this, too Ta",[9874455]
649,Melike Peterson   explores value of everyday encounters for living with difference in hyper-diverse areas,[9881584]
650,Checking last year's publication and realizing I got 3 citations! flabbergasted bigpotofchocolatemousse reallyhappy,[9881584]
651,Happy to see that my article is now open access!  Living with difference in hyper-diverse areas,[9881584]
652,"Self-tracking in the Digital Era Biopower, Patriarchy, and the New Biometric Body Projects",[10039041]
653,I love the patriarchy's commitment with objective mesures ,[10039041]
654,le sigh,[10039041]
655,This seems like a bit of a stretch to me,[10039041]
656,"Fitness tracking apps are ""patriarchy,"" --- says a feminist scholar well-versed in Foucault",[10039041]
657,Why training apps are patriarchal,[10039041]
658,"Self-tracking in the Digital Era Biopower, Patriarchy, and the New Biometric Body Projects -",[10039041]
659,newarticle by Sally Sargeson on land ownership and democratic participation in Chinese communities Read here,[10053550]
660,The Links Between Youth Employment and Educational Attainment Across Racial Groups,[10065241]
661,Free The Links Between Youth Employment and Educational Attainment Across Racial Groups,[10065241]
662,New article with   in   on the counterinsurgency/conservation nexus in the Virunga Park,[10093251]
663,"New article on armed conservation in Virunga, conflict dynamics and contestations DRC together with",[10093251]
664,"Guerrilla livelihoods and the dynamics of conflict and violence in the Virunga National Park, DRC Congo",[10093251]
665,New article with   in   on the counterinsurgency/conservation nexus in the Virunga Park h,[10093251]
666,"Via   On Virunga NP, DRC Increased militarisation of conservation fuels insurgent mobilisation",[10093251]
667,"Excited to read latest of   and   on Virunga, helping to understand its complexities",[10093251]
668,New article on the counterinsurgency/conservation nexus in the Virunga    -    Kivu,[10093251]
669,New article on the counterinsurgency/conservation nexus in the Virunga    -,[10093251]
670,newarticle by   and   on the counterinsurgency conservation nexus in the DRC,[10093251]
671,How conservation and counterinsurgency are intertwined in Congo's Virunga National Park conservation DRCongo,[10093251]
672,"New article on armed conservation in Virunga, conflict dynamics and contestations DRC together with   ht",[10093251]
673,EU claims support to Virunga increased security But security for who and where? Research shows different conclusion,[10093251]
674,"Really great paper on the serious problems with the militarization of conservation, esp In Africa using Virunga N Park",[10093251]
675,EU claims support to Virunga increased security But security for who and where? Research shows different conclusion ht,[10093251]
676,"Great article by      on counterinsurgency and conservation in Virunga Nat'l Park, DRC",[10093251]
677,"Hi Devin, yes very common, esp in central sector of Virunga See here for more info about these joint operations",[10093251]
678,Virunga Guerrilla livelihoods and dynamics of conflict/violence,[10093251]
679,"newarticle by Astuti and McGregor on indigenous landclaims, greengrabs and forest carbon politics in Indonesia",[10116964]
680,"De-naturalizing ecological disaster colonialism, racism and the global Dust Bowl of the 1930s",[10119713]
681,"newarticle by Hannah Holleman on ecological disaster, colonialism, racism and the global DustBowl of the 1930s h",[10119713]
682,New on  The post-Islamist problematic ?'s of religion and difference in everyday life,[10133454]
683,"In a timely new paper, Banu Gkarksel and Anna Secor explore 'post-Islamism' in religion and everyday life in Turkey",[10133454]
684,"In a timely new paper, Banu Gkarksel and Anna Secor explore 'post-Islamism' in religion and everyday life in Turkey ",[10133454]
685,Very timely new publication on post-Islamism and Turkey in   by Gokariksel and Secor,[10133454]
686,"newarticle by Gewertz and Errington on intensive agriculture, prairie heritage and land repurposing in SouthDakota",[10177242]
687,"Amil Mohanan from   reviews Stephen Legg's ""Prostitution and the ends of empire""",[10180423]
688,"Amil Mohanan from   reviews Stephen Legg's ""Prostitution and the ends of empire""  ",[10180423]
689,"Sjstedt Landn, Ljuslinder and Lundgren   analyse the moral geographies of public sector job relocation",[10262538]
690,"Sjstedt Landn, Ljuslinder and Lundgren   analyse the moral geographies of public sector job relocation ",[10262538]
691,"Check out recent articles on Nordic social and cult geog,  like this on public sector relocations in Sweden NGM2017",[10262538]
692,"Check out recent articles on Nordic social and cult geog,  like this on public sector relocations in Sweden",[10262538]
693,"""Ideological images of geographies are bound up with the ongoing struggle for economic and social resources"" politicalgeography",[10262538]
694,newarticle by   and   on credibility and class in the evolution of publicbanks in Turkey,[10264346]
695,newarticle by   and   on credibility and class in the evolution of publicbanks in Turkey ,[10264346]
696,Print copy now available! Credibility and class in the evolution of public banks the case of Turkey,[10264346]
697,newarticle by Lonie S Newhouse on assembling landcontrol after displacement in rural SouthernSudan,[10267007]
698,Chinese concerned others judge performance in large audiences v small more than USA Face/Dignity cultures key,[10277726]
699,I Am Dumber When I Look Dumb in Front of Many vs Few Others A Cross-Cultural Difference in How Audience S,[10277726]
700,Study shows cultural difference in how audience size affects self-Judgments and how we think others perceive us,[10277726]
701,I Am Dumber When I Look Dumb in Front of Many vs Few Others,[10277726]
702,"""I Am Dumber When I Look Dumb in Front of Many vs Few Others"" in Journal of Cross-Cultural Psychology",[10277726]
703,"excited to share with y'all most recent article   and I wrote about lawns, sustainability, and privilege",[10334704]
704,Amy Lebowitz and Dan Trudeau   have researched 'lawn dissidents' who violate norms of N Am suburban yards,[10334704]
705,Amy Lebowitz and Dan Trudeau   have researched 'lawn dissidents' who violate norms of N Am suburban yards ,[10334704]
706,"Digging in lawn dissidents, performing sustainability, and landscapes of privilege",[10334704]
707,Temporal Relationships Between IndividualismCollectivism and the Economy in Soviet Russia Google Ngram analysis,[10344108]
708,Temporal Relationships Between IndividualismCollectivism and the Economy in Soviet Russia Google Ngram analysis htt,[10344108]
709,"20th Century Russian collectivist/individualist expression using Ngrams, and correlation with economic growth",[10344108]
710,"Experimenting with Affect across Drawing and Choreography In this article, I analyse line-re bodyandsociety",[10349305]
711,Corporeal Commodification and Womens Work Feminist Analysis of Private Umbilical Cord Blood  bodyandsociety,[10349315]
712,"Nick Schuermans explores the mobile encounters of white, middle class South Africans as they move through Cape Town",[10369958]
713,"Nick Schuermans explores the mobile encounters of white, middle class South Africans as they move through Cape Town ",[10369958]
714,"Really good piece - a special mention for the add visible in figure 2, which had me laughing aloud teasing cc",[10369958]
715,and K Jenkins discuss the relational politics of life history methods and development research in India,[10370119]
716,and K Jenkins discuss the relational politics of life history methods and development research in India ,[10370119]
717,Cross-Cultural Comparisons of Infant Fear A Multi-Method Study in Spain and the United States,[10373709]
718,SAGEpsychology Confucian Culture Still Matters The Benefits of Zhongyong Thinking Doctrine of the Mean for M,[10373951]
719,Confucian Culture Still Matters The Benefits of Zhongyong Thinking Doctrine of the Mean for Mental Health,[10373951]
720,"SAGEpsychology Do you over/underestimate your abilities? Authors Kim, Kwon, Lee, and Chiu discuss why here -",[10374028]
721,"Do you over/underestimate your abilities? Authors Kim, Kwon, Lee, and Chiu discuss why here -",[10374028]
722,AssistProf   in  's Race Ethnicity and Education on the school experience of 3 Black teachers,[10374766]
723,AssistProf   in  's Race Ethnicity and Education on the school experience of 3 Black teachers ht,[10374766]
724,Issue Information,[10708165]
725,"""Coping as a Mediator Between Losing Face and Depressive and Social Anxiety Symptoms Among Asian Americans""--",[10761363]
