,body,cites_papers
1233,Multi-species coral Sr/Ca-based SST reconstruction using O faveolata and  S siderea from the Florida Straits,[12977096]
1234,"Flannery,   et al  Multispecies coral sea surface temperature reconstructions from the Florida Straits",[12977096]
1235,More  climatescience from    badlandsnationalpark  ClimateChangeIsReal,[12977096]
1236,"Flannery,   et al  Multispecies coral sea surface temperature reconstructions from the Florida Straits ",[12977096]
1237,Multi-species coral recon from FL Keys featuring,[12977096]
1238,", Cramer, JGR  Space Physics,",[12983644]
1239,CP Two Interglacials  Scientific Objectives and Experimental Designs for CMIP6 and PMIP4 Holocene and Last Interg,[12990838]
1240,Two Interglacials  Scientific Objectives and  Experimental Designs for CMIP6/PMIP4 Holocene and  Last Interglacial Sims,[12990838]
1241,Two Interglacials  Scientific Objectives and Experimental Designs for CMIP6 and PMIP4 Holocene and Last Inter,[12990838]
1242,Two Interglacials  Scientific Objectives and  Experimental Designs for CMIP6/PMIP4 Holocene and  Last Interglacial Sims ,[12990838]
1243,New paper  Two Interglacials  Scientific Objectives and Experimental Designs for CMIP6 and PMIP4 Holocene and,[12990838]
1244,""" Objectives and Experimental Designs for CMIP6 and PMIP4 Holocene and Last Interglacial Simulations""  Discussion",[12990838]
1245,Two Interglacials  Scientific Objectives and Experimental Designs for CMIP6 and PMIP4 Holocene and Last,[12990838]
1246,Suprathermal electrons near the nucleus of comet 67P/CG at 3AU  Model comparisons with Rosetta data,[13001863]
1247,Observation of one such region in the Earths magnetosheath is presented in my 2nd paper   scicommUU17,[13001864]
1248,"""The Rauenberg fossil Lagersttte  A window into early Oligocene marine and coastal ecosystems of Central Europe""",[13029238]
1249,The Rauenberg fossil Lagersttte  Germany   a window into Oligocene marine and  coastal ecosystems of Central Europe,[13029238]
1250,Relationships of species of Armigatus and  a new species from Cretaceous of Croatia    - v,[13046512]
1251,Nice new paper from   on Pliocene climate sensitivity  ECS 1 8 to 3 6 C per doubling,[5006046]
1252,Dental mesowear  vegetation/niche separation in Pleistocene  proboscideans - Juha Saarinen/Adrian Lister,[13084155]
1253,Tale of the teeth  what mammoths ate   Adrian Lister and  Juha Saarinen,[13084155]
1254,Tale of the teeth  what mammoths ate   Adrian Lister and  Juha Saarinen   ,[13084155]
1255,Reconnection events in Saturn's magnetotail  Dependence of plasmoid  lra  leicester,[13085508]
1256,Sauropod biomechanics from   and     FossilFriday   OpenAccess in time for  OpenAccessWeek2016,[13096291]
1257,More insights into sauropodomorph cranial mechanics and evolution with   and   Congrats David!,[13096291]
1258,cranial myology and biomechanics of Plateosaurus and Camarasaurus and evolution of the sauropod feeding apparatus,[13096291]
1259,Comparative cranial myology and  biomechanics of Plateosaurus and Camarasaurus  evolution of sauropod feeding apparatus,[13096291]
1260,Comparative cranial myology and biomechanics of Plateosaurus and Camarasaurus and evolution of the sauropod,[13096291]
1261,Comparative cranial myology and biomechanics of Plateosaurus and Camarasaurus via,[13096291]
1262,Deccan related climate fluctuations not the cause of  KT nannoplankton extinction   KTImpactRecap Thibault and  Husson,[4367753]
1263, New from,[5006046]
1264,More insights into sauropodomorph cranial mechanics and evolution with   and   Congrats David! ,[13096291]
1265,"Dryad link is now active  Stls of the 3D models and 35, yes 35 FE models to download","[13096291,13107641]"
1266,Comparative cranial myology biomechanics of Plateosaurus/ Camarasaurus  sauropod feeding apparatus,[13096291]
1267,Comparative cranial myology and biomechanics of Plateosaurus and Camarasaurus,[13096291]
1268,My latest outing with   and   - biomech analysis into the evolution of the  sauropod skull,[13096291]
1269,How dinosaurs ate  study of sauropod biting musculature shows evolution of eating habits New in  Palaeontology,[13096291]
1270,MunchingMonday HT,[13096291]
1271,Sauropod biomechanics from   and     FossilFriday   OpenAccess in time for  OpenAccessWeek2016  ,[13096291]
1272,v/  How  dinosaurs ate  study of sauropod biting musculature    Palaeontology,[13096291]
1273,How dinosaurs ate  study of sauropod biting musculature shows evolution of eating habits New in  Pal,[13096291]
1274,"Regarding the first, see Hargreaves and Annan,     2/n",[5006046]
1275,v/  How  dinosaurs ate  study of sauropod biting musculature    Palaeontology ,[13096291]
1276,Camarasaurus vs Plateosaurus  comparing bites,[13096291]
1277,New paper Reconstructing the confluence zone between the Laurentide and Cordilleran ice sheets,[13123744]
1278,New paper Reconstructing the confluence zone between the Laurentide and Cordilleran ice sheets    ht,[13123744]
1279,2x papers on Meerfelder Maar! A Lateglacial 10Be record and  11-yr climate osc before YD onset,"[13047378,13125047]"
1280,2x papers on Meerfelder Maar! A Lateglacial 10Be record and  11-yr climate osc before YD onset htt,"[13047378,13125047]"
1281,"Open Access UCL Research  Climatic variability over the last 30,000 years recorded in La Piscina de Yuriria, a",[13130771]
1282,Holocene dynamics in the Bering Strait inflow to the Arctic and the Beaufort Gyre circulation based on sedime,[13186427]
1283,New paper  Holocene dynamics in the Bering Strait inflow to the Arctic and the Beaufort Gyre circulation base,[13186427]
1284,CP Holocene dynamics in the Bering Strait inflow to the Arctic and the Beaufort Gyre circulation based on sedimen,[13186427]
1285,"CP The Last Glacial Maximum in central North Island, New Zealand  palaeoclimate inferences from glacier modelling",[5006091]
1286,Holocene dynamics in the Bering Strait inflow to the Arctic and the Beaufort Gyre circulation based on sedimentary,[13186427]
1287,Oceanography OS  High-Resolution Observations in the Western Mediterranean Sea  The REP14-MED Experiment,[13212580]
1288,OS High-Resolution Observations in the Western Mediterranean Sea  The REP14-MED Experiment,[13212580]
1289,Centennial to millennial climate variability in the far northwestern Pacific  off Kamchatka  and its linkage,[13212789]
1290,New D-paper  Centennial to millennial climate variability in the far northwestern Pacific  off Kamchatka  and its,[13212789]
1291,CP Centennial to millennial climate variability in the far northwestern Pacific  off Kamchatka  and its linkage t,[13212789]
1292,Centennial to millennial climate variability in the far northwestern Pacific  off Kamchatka  and its linkage to,[13212789]
1293,Oceanography OS  Technical Note  Volume Transport Equations in Combined Sverdrup-Stommel-Munk Dynamics without Le,[13215709]
1294,OS Technical Note  Volume Transport Equations in Combined Sverdrup-Stommel-Munk Dynamics without Level of no Moti,[13215709]
1295,"Vanneste et al ,JQS  Elevated dust deposition Tierra del Fuego resulting from Darwin Cordillera glacier fluctuations",[13226825]
1296,"The Last Glacial Maximum in central North Island, New Zealand  palaeoclimate inferences from glacier modelling",[5006091]
1297,Reconstructing body sizes of Quaternary lizards usingPholidoscelis and Anolis as case studies    - v,[13265132]
1298,A new Echimyidae from late Miocene of S  South America    - v,[13265134]
1299,"A New Echimyidae  Rodentia, Hystricomorpha  from the Late Miocene of Southern South America  mammals",[13265134]
1300,"Ullumys, new extinct spiny rat related to living punar  Named for Ullm, which I visited in 2011 while at CLPV IV!",[13265134]
1301,Lots of co-authors -   and  many more!,[13278194]
1302,Now open for discussion!   climate,[13278194]
1303,"Thanks to our lead author,  !",[13278194]
1304,Now open for discussion! ,[13278194]
1305,Lots of co-authors -   ,[13278194]
1306,New D-paper  ,[13278194]
1307,"New CP paper  The Last Glacial Maximum in central North Island, New Zealand  palaeoclimate inferences from gla",[5006091]
1308,Way to go   et al!  What a great resource regarding climate history!,[13278194]
1309,"NE US climate over 3000 yrs - Marlon,  ,  ,  ,  ,  ,   etc",[13278194]
1310,Discussion paper by   and al - Climatic history of the northeastern US during the past 3000 years  +me,[13278194]
1311,New D-paper  Linking catchment hydrology and ocean circulation in Late Holocene southernmost Africa,[13294650]
1312,CP Linking catchment hydrology and ocean circulation in Late Holocene southernmost Africa,[13294650]
1313,Linking catchment hydrology and ocean circulation in Late Holocene southernmost Africa,[13294650]
1314,"Oceanography OS  Acoustic and optical methods to infer water transparency at Time Series Station Spiekeroog, Wadd",[13339091]
1315,"New CP discussion  The Last Glacial Maximum in central North Island, New Zealand  palaeoclimate inferences fro",[5006091]
1316,New in  Palaeontology  detailed analysis of the composition of Cambrian SSFs from China,[13363034]
1317,Link to article is below  Arroyo Chasic is one of the  Miocene sites featured in  HornedArmadillos,[13380910]
1318,"Demise of Late Triassic sponge mounds along N W  margin of Yangtze Block, S  China and  Carnian Pluvial Phase  ",[13399495]
1319,Assessing elemental ratios as a palaeotemp proxy in the CaCO3 shells of patelloid limpets  ,[13399496]
1320,"Glacio-archaeological evidence of warmer climate during the Little Ice Age in the Miyar basin, Lahul Himalaya, India",[13400726]
1321,"CP Glacio-archaeological evidence of warmer climate during the Little Ice Age in the Miyar basin, Lahul Himalaya,",[13400726]
1322,New online  The oldest Cenozoic mammal fauna of Europe,[13417442]
1323,Oldest Cenozoic mammal fauna of Europe  implication of Hainin  fauna for Paleocene mammalian evolution and  dispersals,[13417442]
1324,Oldest Cenozoic mammal fauna of Europe  implication of Hainin reference fauna for evolution    - v,[13417442]
1325,Palaeoenvironmental vs  evolutionary control on size variation of coccoliths across Lower-Middle Jurassic  ,[13426494]
1326,"""The Last Glacial Maximum in central North Island, New Zealand  palaeoclimate inferences from glacier modelling""",[5006091]
1327,Svalbard ice-sheet decay after the Last Glacial Maximum  ,[13426496]
1328,cpd  discussionpaper Response of the carbon cycle to the different orbital configurations of last 9 interglacials,[13426735]
1329,New D-paper  ,[13426735]
1330,CP The influence of ice sheets on the climate during the past 38 million years,[13442623]
1331,The influence of ice sheets on the climate during the past 38 million years,[13442623]
1332,New D-paper  The influence of ice sheets on the climate during the past 38 million  years,[13442623]
1333,Temporal and  spatial patterns of sediment deposition in N  South China Sea over last 50Ka  ,[13467991]
1334,"Palaeoenvironmental analysis of the ichnogenus Zoophycos in Lower Devonian tempestites of, Sichuan, China  ",[13467992]
1335,Re-evaluation of using rhodolith growth patterns for paleoenvironmental reconstruction  the Gulf of Panama,[13468908]
1336,"New Online  New palaeothentid marsupials from the middle Miocene of Quebrada Honda, Bolivia",[13469221]
1337,FossilFriday Bolivian Miocene marsupial with an abscess problem,[13469221]
1338,"New palaeothentid marsupials from Bolivian M  Miocene, and  palaeoecology of Palaeothentoidea    - v",[13469221]
1339,"Lovely new palaeothentids - extinct relatives of the enigmatic ""shrew opossums"" that still live in South America today",[13469221]
1340,"Lovely new palaeothentids - extinct relatives of the enigmatic ""shrew opossums"" that still live in South America today htt",[13469221]
1341,Three new palaeothentid species plus phylogeny and paleobiology in our lab's new paper by   grad student Russell Engelman,[13469221]
1342,Three new palaeothentid species plus phylogeny and paleobiology in our lab's new paper by   grad student Russell Engelman ,[13469221]
1343,New online  ,[13493634]
1344,The earliest Triassic siliclastic marine assemblage by my collaborators at,[13493634]
1345,What survived Permian mass extinction 250M years ago?   Richard Twitchett and  al,[13493634]
1346,"Scanning publication alerts, just did the ""hey, that looks interesting    oh right, yeah, I'm a co-author"" thing",[13502273]
1347,Oceanography OS  ,[13508757]
1348,"Oceanography OS  El Nio, La Nia, and the global sea level budget",[13515092]
1349,"OS El Nio, La Nia, and the global sea level budget",[13515092]
1350,"El Nio, La Nia, and the global  sea level budget via    openaccess  oceanography",[13515092]
1351,"El Nio, La Nia, and the global  sea level budget via    openaccess  oceanograph",[13515092]
1352,"ElNio,  LaNia, and the global  sea level budget",[13515092]
1353,"A new tetrapod ichnotaxon from Botucatu Formation, Lower Cretaceous  Neocomian , Brazil, with comments on fossil",[13519500]
1354,New CP discussion  ,[5006116]
1355,"Here is my first 2017 paper with Pedro Buck, Bernardo Peixoto, Luciana  and Marcelo Fernandes  Publicando no futuro!",[13519500]
1356,"Here is my first 2017 paper with Pedro Buck, Bernardo Peixoto, Luciana  and Marcelo Fernandes  Publicando no futuro! htt",[13519500]
1357,"WOW!! New tetrapod ichnotaxon from Botucatu Formation, Brazil, w/comments on fossil track preservation     FossilFriday  ichnology",[13519500]
1358,"WOW!! New tetrapod ichnotaxon from Botucatu Formation, Brazil, w/comments on fossil track preservation     FossilFriday",[13519500]
1359,"FossilFriday ""new tetrapod ichnotaxon from Brazil, w/comments on  fossil track preservation on inclined planes and  local paleoecology""",[13519500]
1360,"A new tetrapod ichnotaxon from Brazil, with comments on  fossil track preservation   et al",[13519500]
1361,Brasilichnium saltatorium  small mammal-like creatures hopping across the Botucatu paleodesert,[13519500]
1362,  lra  leicester,[13528180]
1363,Planetary period oscillations in Saturn's magnetosphere  Coalescence and  lra  leicester,[13528182]
1364,"New review of  massextinctions and how we might better understand them  Open Access so pls share, enjoy, criticise",[13566034]
1365,Climatic fluctuations and sea-surface water circulation patterns at the end of the Cretaceous era,[4367753]
1366,New CP paper  ,[5006116]
1367,This looks fascinating  Good counterweight to the 'dark matter killed the dinosaurs' view on things,[13566034]
1368,Great review article on the planet's major mass extinctions from one of the top experts,[13566034]
1369,New  GEESresearch review paper,[13566034]
1370,Did you reference this in,[13566034]
1371,"New review of  massextinctions and how we might better understand them  Open Access so pls share, enjoy, criticise  ",[13566034]
1372,Study of biotic crises in the  pre-Cenozoic  Phanerozoic implies volcanism might be driver of high extinction rates,[13566034]
1373,On causes of mass extinctions  OA,[13566034]
1374,  ScienceDirect  environment,[13566034]
1375,Different causes of massa extinction of life in the past - an array of mechanisms,[13566034]
1376,"You can get the whole issue of Palaeogeography, Palaeoclimatology, Palaeoecology on global extinction here for free",[13566034]
1377,"You can get the whole issue of Palaeogeography, Palaeoclimatology, Palaeoecology on global extinction here for free  ",[13566034]
1378,Our  GEESresearch featured in  's NY Times article on the Permian extinction,[13566034]
1379,Hull's Earth science research is gaining recognition on international ground   geology,[13566034]
1380,"Really interesting article, great work!",[13566034]
1381, - ScienceDirect via,[13566034]
1382,Research by our Dr David Bond and  colleagues is featured in the NY Times    GEESresearch,[13566034]
1383,I recommend latest review paper,[13566034]
1384,Our  GEESresearch featured in  's NY Times article on the Permian extinction  ,[13566034]
1385,Hot paper from Palaeontology  journal! Researchers Uncover Details Behind Dinosaur-Era Birds Feathers -read in full,[13578506]
1386,  SHAPE  OA,[5006116]
1387,First enantiornithine reported to preserve iridescent melanosome morphologies  birds  dinosaurs,[13578506]
1388,Our new paper on ornamental plumage of an immature enantiornithine is out!,[13578506]
1389,Our shiny new paper on shiny iridescent enantiornithine,[13578506]
1390,"Beautiful plumage! Bird feathers and their pigmentation, from the age of dinosaurs",[13578506]
1391,The plumage and colouration of an enantiornithine bird from the Early Cretaceous of China,[13578506]
1392,The plumage and colouration of an enantiornithine bird from the Early Cretaceous of China HT,[13578506]
1393,The plumage and colouration of an enantiornithine bird from the Early Cretaceous of China HT  ,[13578506]
1394,Hot paper from Palaeontology  journal! Researchers Uncover Details Behind Dinosaur-Era Birds Feathers -read in full ,[13578506]
1395, - Peteya - 2016 -,[13578506]
1396,Quantification of southwest China rainfall during the 8 2 ka BP event with response to North Atlantic cooling,[5006137]
1397,Hot paper from Palaeontology journal! Researchers Uncover Details Behind Dinosaur-Era Birds Feathers - read in full,[13578506]
1398,The plumage and colors of an immature bohaiornithid enantiornithine!  birds  dinosaurs,[13578506]
1399,Peteya et al    ,[13578506]
1400,Our new paper on ornamental plumage of an immature enantiornithine is out!     ,[13578506]
1401,Iridescent and ornamental feathers in  fossil enantiornithine bird from Cretaceous of China,[13578506]
1402,Cretaceous flight in colour,[13578506]
1403,120 million year old dino-bird had colourful plumage and could fly  Science is cool,[13578506]
1404,Lovely plumage,[13578506]
1405,Plumage and  colouration of an enantiornithine  bird from Early Cretaceous of  China via    FossilFriday  OA,[13578506]
1406,Plumage and  colouration of an enantiornithine  bird from Early Cretaceous of  China via  ,[13578506]
1407,CP Quantification of southwest China rainfall during the 8 2 ka BP event with response to North Atlantic cooling,[5006137]
1408,Hot paper from Palaeontology journal! Researchers Uncover Details Behind Dinosaur-Era Birds Feathers - read in full ,[13578506]
1409,Happy  chinesenewyear- to celebrate here's a colourful  Palaeontology paper on a Chinese bird  yearoftherooster  OA,[13578506]
1410,New  First species of Enantiornithes from Sihedang elucidates skeletal development in E  Cretaceous enantiornithines,[13589268]
1411,"Is it enantiornithine day? A new species, Monoenantiornis sihedangia   birds  dinosaurs",[13589268]
1412,"New Enantiornithine theropod, Monoenantiornis, from the Yixian Formation in China",[13589268]
1413,New  First species of Enantiornithes from Sihedang elucidates skeletal development in E  Cretaceous enantiornithines ht,[13589268]
1414,1st sp  of E  Cretaceous Sihedang Enantiornithine shows skeletal development of the group    - v,[13589268]
1415,Extensive anoxic event in Triassic of S  China Block  ,[13614231]
1416,New CP paper  Quantification of southwest China rainfall during the 8 2 ka BP event with response to North Atl,[5006137]
1417,Oceanography OS  ,[13619502]
1418,Tafonoma de los mamferos del Mioceno de Somosaguas  con   y ms,[13626006]
1419,"Taphonomy of mammalian fossil bones from the Middle Miocene debris-flow deposits of Somosaguas  Madrid, Spain",[13626006]
1420,"OS Sub-basin-scale sea level budgets from satellite altimetry, Argo floats and satellite gravimetry  a case study",[13642825]
1421,"Oceanography OS  Sub-basin-scale sea level budgets from satellite altimetry, Argo floats and satellite gravimetry",[13642825]
1422,CPD  discussionpaper Record of Oman margin upwelling indicates persistent solar forcing of ISM after early Holocene,[13684766]
1423,Decadal resolution record of Oman margin upwelling indicates persistent solar forcing of the Indian summer monsoon,[13684766]
1424,CP Decadal resolution record of Oman margin upwelling indicates persistent solar forcing of the Indian summer mon,[13684766]
1425,Explaining high-diversity death assemblages  ,[13721591]
1426,New CP discussion  Quantification of southwest China rainfall during the 8 2 ka BP event with response to Nort,[5006137]
1427,New online  Evolutionary trends and  biostrat  application of new Cenomanian alveolinoids from Natih Formation of Oman,[13742989]
1428,"FossilFriday Cenomanian alveolinoid Reichelia magna, one of many forams recently described from the Oman Mountains",[13742989]
1429,Read the full text in    foraminifera,[13742989]
1430,"FossilFriday Cenomanian alveolinoid Reichelia magna, one of many forams recently described from the Oman Mountains htt",[13742989]
1431,"New research published in the latest issue of  , free download  forams   evolution  biostratigraphy",[13742989]
1432,"New research published in the latest issue of  , free download  forams   evolution",[13742989]
1433,OS A stable Faroe Bank Channel overflow 19952015,[13750889]
1434,Oceanography OS  A stable Faroe Bank Channel overflow 19952015,[13750889]
1435,Palaeoceanographic changes in N E  Indian Ocean during M  Miocene inferred from C and  O isotopes of foram fossils  ,[13776329]
1436,"Elegestolepisand  its kin, earliest monodontode chondrichthyans    - v",[13802041]
1437,CP Quantification of southwest China rainfall during the 8 2 ka BP event with response to Nor,[5006137]
1438,Pliocene mekosuchine from Lake Eyre Basin of S  Australia    - v,[13802356]
1439,The paper's in JVP,[13802356]
1440,New lungfish from Late Triassic of S  America    - v,[13835733]
1441,Oceanography OS  Inorganic and organic geochemical fingerprinting of sediment sources  and ocean circulation on a,[13852315]
1442,OS Inorganic and organic geochemical fingerprinting of sediment sources  and ocean circulation on a complex conti,[13852315]
1443,CP Tropical forcing of increased Southern Ocean climate variability revealed by a  140-year  subantarctic  temper,[13853471]
1444,CPD  discussion Tropical forcing of increased SOcean climate var revealed by 140yr subantarctic temperate recon,[13853471]
1445,Tropical forcing of increased Southern Ocean climate variability revealed by a 140-year subantarctic temperate,[13853471]
1446,Subantarctic Dracophyllum tree rings reveal tropical forcing of increased Southern Ocean climate variability,[13853471]
1447,Tropical forcing of increased Southern Ocean climate variability revealed by a 140-year subantarctic   NERCpapers,[13853471]
1448,"""Quantification of southwest China rainfall during the 8 2 ka BP event with response to North Atlantic cooling""",[5006137]
1449,"Prof  Turney also discussed a cool new 140-yr tree ring record from the southern ocean, deets  amos2017",[13853471]
1450,CPD  discussionpaper ,[13862827]
1451,Molecular and microstructural analysis of an Eocene  putative parrot  feather,[13868489]
1452,"Another study testing fossil melanosomes  Yes, melanosomes, again! How many times do we need to beat the dead horse?",[13868489]
1453,Very nice work from Geology Department at  lunduniversity,[13868489]
1454,Very nice work from Geology Department at  lunduniversity   ,[13868489]
1455,"Another study testing fossil melanosomes  Yes, melanosomes, again! How many times do we need to beat the dead horse? ",[13868489]
1456,X-ray and SEM analysis of 54 myr old  fossil bird feather reveals pigment cells similar to those of modern parrots,[13868489]
1457,Oceanography OS  DUACS DT2014   the new multi-mission altimeter dataset reprocessed over 20 years,[5006139]
1458,Re-Os ID of glide faulting and  precise ages for correlation from U  Jurassic S W  Barents Sea  ,[13876454]
1459,CPD  discussionpaper Development and  evaluation of a system of proxy dataassimilation for paleoclimate reconstruction,[13877577]
1460,New D-paper  ,[13877577]
1461,Oceanography OS  High-resolution monitoring of marine protists based on an observation strategy integrating autom,[13887874]
1462,OS High-resolution monitoring of marine protists based on an observation strategy integrating automated on-board ,[13887874]
1463,Oceanography OS  Predicted ripple dimensions in relation to the precision of in situ measurements in the southern,[13887875]
1464,My 2nd paper on the Mars' plasma environment and annual variability of the bow shock position is now online!,[13899585]
1465,Warming + very rapid changes in sea-surface temps at end of the Cretaceous  Timing matches Deccan volcanism,[4367753]
1466,OS DUACS DT2014   the new multi-mission altimeter dataset reprocessed over 20 years,[5006139]
1467,Palaeolatitudinal distribution of fossil wood genera as a proxy for European Jurassic terrestrial climate  ,[13960281]
1468,"New online  Fish otoliths of the Aquitaine Basin  France , breakthrough in knowledge of European Eocene ichthyofauna",[13963502]
1469,"New online  Fish otoliths of the Aquitaine Basin  France , breakthrough in knowledge of European Eocene ichthyofauna ht",[13963502]
1470,New D-paper  ,[13964328]
1471,Lower Silurian stromatolites in shallow-marine environments of S  China Block and  their palaeoenvironment  ,[14023900]
1472,Cenomanian to Coniacian Water-mass Evolution in the Cretaceous Western Interior Seaway of North America and,[14026737]
1473,New D-paper  Cenomanian to Coniacian Water-mass Evolution in the Cretaceous Western Interior Seaway of North Amer,[14026737]
1474,sick paper on myoanatomy from a stem group arthropod from Fletcher Young and,[14056600]
1475,OS Major improvement of altimetry sea level estimations using pressure derived corrections based on ERA-interim a,[5006210]
1476,Reconstructing musculature of arthropods from Cambrian of Greenland  FossilFriday,[14056600]
1477,The continued pursuit in finding utility and taphonomy of fossil muscle--here is the muscle anatomy of Pambdelurion,[14056600]
1478,The continued pursuit in finding utility and taphonomy of fossil muscle--here is the muscle anatomy of Pambdelurion ,[14056600]
1479,Onychophoran-like myoanatomy of the Cambrian gilled lobopodian Pambdelurion whittingtoni,[14056600]
