,body,cites_papers
243,"New papers in SCG on 'Enlivening and politizising the geographies of dying, death and mourning' inc OpenAccess",[6132301]
244,"New papers in SCG on 'Enlivening and politizising the geographies of dying, death and mourning' inc ",[6132301]
245,"Interesting read paper on ""Foreign language communication anxiety",[6136991]
246,"Family, Peer, and Pubertal Determinants of Dating Involvement Among Adolescents - Low - 2016 -",[6137440]
247,"What's linked w/ early teen dating? Early puberty, hands-off parents, rebellious older siblings, and delinquent peers",[6137440]
248,"Family, Peer, and Pubertal Determinants of Dating Involvement Among Adolescents",[6137440]
249,"Family, Peer and Pubertal Determinants of Dating Involvement among Adolescents HT",[6137440]
250,Research Life Satisfaction Among Ethnic Minorities in Europe,[6137857]
251,Life Satisfaction Among Ethnic Minorities in Europe Although life satisfaction LS of ethnic minorities can,[6137857]
252,"New in scgjournal - John and Carlson explore remembrance, healing and justice through the Dakota Commemorative March",[6147870]
253,"New in scgjournal - John and Carlson explore remembrance, healing and justice through the Dakota Commemorative March ",[6147870]
254,Check out this new   paper by Gareth John and  !,[6147870]
255,new paper from Erica - Fanons other children psychopolitical and pedagogical implications,[6155550]
256,"New article by Drs Melissa A Martinez, Anjale AJ Welton, and Aurora Chang  Melissa and AJ are EDA alumnas",[6156424]
257,"Social Justice, Research, and Adolescence - Russell - 2016 - Journal of Research on Adolescence",[6162200]
258,"Social Justice, Research, and Adolescence HT",[6162200]
259,How can research on adolescence contribute to social justice? My   address is here,[6162200]
260,Part-Time Employment and Problem Behaviors Evidence From Adolescents in South Korea - Lee -,[6162443]
261,Part-Time Employment and Problem Behaviors Evidence From Adolescents in South Korea,[6162443]
262,"A paper on how parents ""do family"" in the car",[6177041]
263,How do we perform family care in the car and why does this impact our CarDependency? New from Waitt and,[6177041]
264,New JPS article on GM soybeans and agribusiness in Argentina,[6194782]
265,"New book review in Social and Cultural Geography ""Off the grid re-assembling domestic lift""",[6205245]
266,My new article Teaching Black history as racial literacy,[6205760]
267,Poetic and provocative world-making from Gabriel Eshun and   in Social and Cultural Geography scgjournal,[6233605]
268,Geography is not what it used to be,[6233605]
269,The intersection of race and class,[6259052]
270,"Out in Soc and Cult Geography David Beckingham explores time, space and alcohol licensing in 1900s Glasgow scgjournal",[6271136]
271,Nice piece of historical research the campaign against barmaids in 1900s Glasgow,[6271136]
272,"Out in Soc and Cult Geography David Beckingham explores time, space and alcohol licensing in 1900s Glasgow",[6271136]
273,Our paper is out there! phdchat hypocoristics    Have a peak!,[6304962]
274,Here's the abstract w/paywall--full text,[6304962]
275,"Language, Culture, and Group Membership  Investigation Into the Social Effects of Colloquial Australian English ",[6304962]
276,New paper out today in Social and Cultural Geography on 'Moral Geographies of Family',[6326730]
277,Important new paper by   in Social and Cultural Geog on the moral geographies of family scgjournal,[6326730]
278,Next time on gcyfrgchat it's   Tues 9th Aug 2-3pm discussing her paper  Get it in your diaries!,[6326730]
279,Next time on gcyfrgchat it's   Tues 9th Aug 2-3pm discussing her paper  Get it i,[6326730]
280,Join us tomorrow for gcyfrgchat with   Tues 9th Aug 2-3pm discussing her paper  family ethics care,[6326730]
281,Join us tomorrow for gcyfrgchat with   Tues 9th Aug 2-3pm discussing her paper  f,[6326730]
282,Don't miss   discuss her paper in   gcyfrgchat TODAY 2-3pm,[6326730]
283,New in Social and Cultural Geog - Varotto and Rossetta explore geographic film-making as public research scgjournal,[6330336]
284,Effective negative feedback is cross-culturally difficult Read more about a study on negative feedback framing,[6358882]
285,SAGEpsychology Effective negative feedback is cross-culturally difficult Read more about a study on negative ,[6358882]
286,New article from Tamara Wattnem on seedlaws and outlawing informal seedsystems in the globalsouth See,[6359308]
287,J of peasant studies Seed laws certification and standardization outlawing informal seed systems in the Global South,[6359308]
288,J of peasant studies Seed laws certification and standardization outlawing informal seed systems in the Global South ,[6359308]
289,"Seed laws, certification and standardization outlawing informal seed systems in the Global South",[6359308]
290,"Seed Laws, Certification and Standardization Outlawing Informal Seed Systems in Global South, Tamara Wattnem, 2016",[6359308]
291,"Becoming ecological citizens connecting people through performance art, food matter and practices openaccess",[6387467]
292,"art/matter/methodology 'Becoming eco citizens connecting people through performance art, food matter and practices'",[6387467]
293,"Using media to increase sustainability behavior Good article, Sage Publications",[6387467]
294,"New from Cultural Geographies - Becoming ecological citizens connecting people thru art, food matter and practices",[6387467]
295,This article maybe of interest to those arguing for foodcitizen as opposd to ethical food consumer,[6387467]
296,here it is Mark open access! Thanks for your interest,[6387467]
297,Modeling Trajectories of Adolescent-Perceived Family Conflict Effects of Marital,[6404526]
298,Modeling Trajectories of Adolescent-Perceived Family Conflict Effects of Marital Dissatisfaction and Parental,[6404526]
299,Latest cultural geog provocation in Soc and Cult Geog-   on why religion matters to geographers scgjournal,[6407630]
300,Further provocations by   in this edition of Social and Cultural Geography  straighttothebibliography,[6407630]
301,Latest cultural geog provocation in Soc and Cult Geog-   on why religion matters to geographers,[6407630]
302,Further provocations by   in this edition of Social and Cultural Geography  straighttothebi,[6407630]
303,Check out  's reflections on critical pedagogy and civil rights in,[6407630]
304,Have you read this by   in  ?  Why does religion matter for cultural geographers?,[6407630]
305,Excellent find for Whit Walks summer research/reading plans Recent article about geographies of religion,[6407630]
306,What are the global routes of ayahuasca? Jonathan Lowell and Paul Adams investigate in Social and Cultural Geography,[6425209]
307,Congrats to Jonathan Lowell on co-authored 'The routes of a plant ayahuasca and the global networks of Santo Daime',[6425209]
308,About time cultural geographers started addressing magic seriously,[6443642]
309,On the concept of place and the poetics of making a tourism destination Read for free,[6443642]
310,"Environmental crisis, narcissism and the work of grief",[6461655]
311,"Environmental crisis, narcissism and the work of grief in cultural geography",[6461655]
312,"New article from Pritchard, Dixon, Hull and Choithani on the role of the state in the contemporary foodregime See",[6468510]
313,"New article from Pritchard, Dixon, Hull and Choithani on the role of the state in the contemporary foodregime See ht",[6468510]
314,FREEACCESS also extended to Pritchard et al's article on the role of the state in the contemporary foodregime,[6468510]
315,FREEACCESS also extended to Pritchard et al's article on the role of the state in the contemporary foodregime htt,[6468510]
316,"Sacred groves, sacrifice zones and soy production globalization, intensification, neonature",[6487153]
317,"Sacred groves, sacrifice zones and soy production globalization, intensification, neonature htt",[6487153]
318,Oliveira and Hecht's intro to the new FREEACCESS special issue on soy is available here,[6487153]
319,Oliveira and Hecht's intro to the new FREEACCESS special issue on soy is available here ,[6487153]
320,New article   and Rachel Gordon on Government and nonevent the promise of control scgjournal,[6526060]
321,New article   and Rachel Gordon on Government and nonevent the promise of control,[6526060]
322,New article with Rachel Gordon in   on events/eventfulness in social and cultural geog/work on security,[6526060]
323,ARGH   has basically already beat me to my exciting idea of studying the 'situation room',[6526060]
324,"Great to see this come out! Congrats, Ben and Rachel!",[6526060]
325,"Paper on nonevents via Berlant, Foucault and control rooms with Rachel Gordon now open access in",[6526060]
326,New   offers a provocation that cultural geographers need 'worldly theory' to think about climate change,[6526180]
327,New   offers a provocation that cultural geographers need 'worldly theory' to think about climate change ,[6526180]
328,"Climate change, cultural geography and worldy theory - George Revill in SocandCultGeog ",[6526180]
329,The Shared Etiology of Attentional Control and Anxiety An Adolescent Twin Study - Gagne - 2016,[6572884]
330,The Shared Etiology of Attentional Control and Anxiety An Adolescent Twin Study,[6572884]
331,Alex Miller from   explores the creative geographies of ceramic artists in a new paper online,[6607937]
332,Dear peer-reviewed diary,[6647123]
333,"Two women reflect on their own politicalizing ""a self-reflexive account of the authors anti-cuts organizing""",[6647123]
334,"Research Call for Papers--Special Issue Europes cultures Negotiating cultural meanings, values, and ident ",[6656020]
335,"Research Call for Papers--Special Issue Europes cultures Negotiating cultural meanings, values, and ident",[6656020]
336,"Call for Papers--Special Issue Europes cultures Negotiating cultural meanings, values, and identities in t",[6656020]
337,"JCCP Call Europes cultures Negotiating cultural meanings, values, and identities Abstract due July15",[6656020]
338,"Negotiating cultural meanings, values, and identities in the European context psychology crosscultural cultures",[6656020]
339,My review of Peter Timmer's Food Security and Scarcity Why Ending Hunger Is So Hard now out paywall ask me 4 copy,[6722092]
340,Book review The Afterlives of the Psychiatric Asylum Recycling Concepts Psychiatry,[6726252]
341,Domain Specificity in Adolescents Concepts of Laws Associations Among Beliefs and Behavior -,[6752366]
342,Domain Specificity in Adolescents Concepts of Laws Associations Among Beliefs and Behavior,[6752366]
343,Domain Specificity in Adolescents Concepts of Laws Associations Among Beliefs and Behavior  Oosterhoff  2016,[6752366]
344,Surveillance and Embodiment Dispositifs of Capture,[6755910]
345,Link between surveillance and embodiment  in special issue of Body and Society,[6755910]
346,Body and Society Surveillance and Embodiment Dispositifs of Capture This article provides a Table of Contents,[6755910]
347,Surveillance and Embodiment Dispositifs of Capture This article provides an introduction to bodyandsociety,[6755910]
348,Surveillance and Embodiment Dispositifs of Capture Body and Society June 2016 22 3-27,[6755910]
349,keywords affect biometrics data embodiment intermediation surveillance,[6755910]
350,"Surveillance, Privacy, and Making of Modern Subject",[6756890]
351,"Surveillance, Privacy and the Making of the Modern Subject Habeas what kind of Corpus? In t bodyandsociety",[6756890]
352,PERSONAL RESIDENCES--FEMALE REALITIES -EXPOSURE SOAP OPERAEXCEPTIONALEXTERMINATIONMURDEROUS INTENTHOSTILITIES,[6756890]
353,New paper out for those interested in Heterotopia assemblage cruiseships and to some extent speculativerealism,[6829511]
354,"Jonathan Rankin and   consider the cruise ship as a processs, not just an object in their new paper",[6829511]
355,New paper out for those interested in Heterotopia assemblage cruiseships and to some extent ,[6829511]
356,Nice to feel the weight of the latest   in paperback! Link to article with   available here,[6829511]
357,Nice to feel the weight of the latest   in paperback! Link to article with   available here ,[6829511]
358,Congrats to my colleague Jonathan on seeing his publication in physical copy! Must've felt good to hold it in your hands upandcoming,[6829511]
359,explores deaf perspectives on diversity and the right to space on Mumbai surburban trains,[6829569]
360,Matthew Mitchelson from   examines relational vulnerability in the research process with former prisoners,[6829627]
361,Matthew Mitchelson from   examines relational vulnerability in the research process with former prisoners ,[6829627]
362,"Check out Dr Matthew Mitchelson's new article, ""Relational Vulnerability and the Research Process with Former","[6829627,6829627]"
363,Issue Information - 2016 - Journal of Research on Adolescence - Wiley Online Library,[6914104]
364,New in the AgrarianClassics series - Julie Guthman reviews Miriam Wells' 'Strawberry Fields' politics class work,[6961423]
365,Sean Robertson of   writes about indigenous sovereignty and the spatial politics of attentiveness,[6963022]
366,"Check out a great new paper by Sean Robertson,  , on indigenous sovereignty",[6963022]
367,New   explores different stories of place and indigeneity in relation to Tromso's would-be Olympic bid,[6963218]
368,Death Reminders Increase Agreement With Extremist Views but Not Violent Extremist Action in Indonesian Muslims $,[6978365]
369,"My article on extremism and violent extremism in Indonesia co-written O'Brien, Bliuc, and   out online",[6978365]
370,"In light of recent attack on Indonesian police, I thought I'd reshare my article looking at extremism in Indonesia",[6978365]
371,Extremely interesting research on extremism in Indonesia!,[6978365]
372,Study Death Reminders Increase Agreement W Extremist Views but Not Violent Extremist Action in Indonesian Muslims,[6978365]
373,"""results suggest that reminders of death may lead yng Muslims to be mre supportive of pol andreligiously extreme views, but not violent action",[6978365]
374,"Thesis draft almost complete, got me thinking about my first ever article looking at extremism in Indonesia",[6978365]
375,"""results suggest that reminders of death may lead yng Muslims to be mre supportive of pol andreligiously extreme views,",[6978365]
376,Interesting article!,[6978365]
377,Death Reminders Increase Agreement With Extremist Views but Not Violent Extremist Action in Indonesian MuslimsJour,[6978365]
378,Death Reminders Increase Agreement With Extremist Views but Not Violent Extremist Action in Indonesian Muslims,[6978365]
379,Study Death Reminders Increase Agreement W Extremist Views but Not Violent Extremist Action in Indonesian Muslims ,[6978365]
380,"""Get Up, Stand Up, Stand Up for Your Rights!"" The Jamaicanization of Youth Across 11 Countries Through Reggae Music",[6981430]
381,article - 'the road to epidaurus is like the road to creation tapping the urban archive',[6982314]
382,"'The road to Epidaurus is like the road to creation' by me, Harriet Hawkins and Joseph Kohlmaier On city as archive",[6982314]
383,No highlighting necessary Provocative enough for you?,[6982314]
384,Walking and talking making strange encounters within the familiar paywall,[6985263]
385,Hilary Ramsden from   writes about making strange encounters within the familiar,[6985263]
386,"We leave self-initiated interventions into aforementioned habitual cultural practices, eg walking and chewing gum, for further research",[6985263]
387,Only in academia  You couldn't make up this kind of foolishness,[6985263]
388,I love this type of twaddle,[6985263]
389,finding this account was divine providence i s2g,[6985263]
390,"Even when they're within shouting distance of something interesting, their instinct is to make it boring and tiresome",[6985263]
391,A peer-reviewed paper literally about walking and talking,[6985263]
392,Revolutionary research Walking and talking at the same time,[6985263]
393,"A new paper by Joao Sarmento explores tourists walking rhythms whilst doing the Tunis Medina, Tunisia",[6985310]
394,"Study on ""walking rhythms"" of tourists in Tunis Can't make this up",[6985310]
395,Is there a global environmental justice movement? Sort of,[7062328]
396,New article 'Is there a global environmental justice movement?' by Martinez-Alier et al available here,[7062328]
397,fascinating paper on global environmental justice - history and global database environment sustainability,[7062328]
398,fascinating paper on global environmental justice - history and global database environment su,[7062328]
399,Is there a global environmental justice movement?   Learn Teach Act,[7062328]
400,David Cairns compares student mobility and graduate migration intentions in austerity era Ireland and Portugal,[7091924]
401,Exploring student mobility + graduate migration undergraduate mobility in Portugal and Ireland highered,[7091924]
402,Exploring student mobility and graduate migration undergraduate mobility propensities in two economic crisis contexts,[7091924]
403,New article on economic crisis and migration now available at Social and Cultural Geography,[7091924]
404,"A new look at international student mobility in Portugal and Republic of Ireland by David Cairns, ISCTE, Uni Lisbon",[7091924]
405,"A new look at international student mobility in Portugal and Republic of Ireland by David Cairns, ISCTE, Uni Lisbon ",[7091924]
406,Geographer suggests that their colleagues should add comic books to their arsenal of tools,[7114939]
407,Geographer suggests that their colleagues should add comic books to their arsenal of tools htt,[7114939]
408,"Tortured language, surely intended to confuse Does this ""cultural geographer"" know there is a difference between cartoon and cartography?",[7114939]
409,"What happens when you have a paper due, but you spent all your time getting stoned and reading comic books JustAddWordSalad",[7114939]
410,"""explore the cartographies of the comic book""  This is why I say there are no experts, the higher education system is a joke",[7114939]
411,Tired of autoethnographies? Cultural geographer suggests using comic books instead,[7114939]
412,"If I saw this document at my workplace, I would contact security and alert a mental health professional",[7114939]
413,Great new paper by my friend   on 'Spatial agency and architecture' in   geography published,"[7144866,7144866]"
414,My new paper in   on geography and progressive architecture beyond buildings is now online and open access,[7144866]
415,My new paper in   on geography and progressive architecture beyond buildings is now online and open access ,[7144866]
416,Great new paper by my friend   on 'Spatial agency and architecture' in   ge,"[7144866,7144866]"
417,'s paper provides a new direction for geographic scholarship on architectural practice beyond buildings,[7144866]
418,Great new paper by   on 'Spatial agency and practising architecture beyond buildings' in,[7144866]
419,New paper by Colin Lorne extending geographic scholarship 'Spatial agency and practising architecture beyond buildings',[7144866]
420,New   article by   on architecture and geography 'beyond buildings' ,[7144866]
421,New   article by   on architecture and geography 'beyond buildings'  ,[7144866]
422,Great paper from   out in the latest    Plus it's openaccess Bonus   geography architecture,[7144866]
423,Thanks for the tweet   - hope the PhD is going well,[7144866]
424,Great paper from   out in the latest    Plus it's openaccess Bonus   geog,[7144866]
425,Open access paper in   on practising architecture beyond buildings,[7144866]
426,Understanding the Lack of Parent-Child Value Similarity The Role of Perceived Norms in Value Socialization i,[7154886]
427,Understanding the Lack of ParentChild Value Similarity Role of Perceived Norms in Immigrant Families Psychology,[7154886]
428,Understanding the Lack of ParentChild Value Similarity Role of Perceived Norms in Immigrant Families,[7154886]
429,"Examining Discrimination, Ethnic-Racial Identity Status, and Youth Public Regard Among Black,",[7157272]
430,"The Roles of Racial Discrimination, Cultural Mistrust, and Gender in Latina/o Youth's School",[7157275]
431,"The Roles of Racial Discrimination, Cultural Mistrust, and Gender in Latina/o Youth's School Attitudes and Acad",[7157275]
432,Check out our pub on racial discrimination and cultural mistrust in gender gap in education Latinxs   DePaul,[7157275]
433,Check out our pub on racial discrimination and cultural mistrust in gender gap in education Latinxs,[7157275]
434,"Yes,   has",[7221334]
435,How traditional approaches have a limited capacity to capture the magic of mental illnesses,[7278545]
436,How traditional approaches have a limited capacity to capture the magic of mental illnesses ht,[7278545]
437,On using magical experiences instead of evidence in research,[7278545]
438,On the magical qualities of illness and recovery read   IWD2017 DUIWD17 mentalhealth,[7278545]
439,On the magical qualities of illness and recovery read   IWD2017 DU,[7278545]
440,Magical realism in narratives of illness and distress,[7278545]
441,How can works of public art impact the re-constitution of place? culturalgeography,[7298988]
442,how a locality can call on its own distinctive creativity for revitalising work-life - beatthelite - newthinking,[7298988]
443,Folkestone perennial the enduring italic toggle='yes'work/italic of art in the re-constitution of place,[7298988]
444,My new paper in   exploring role of animals in creating and facilitating therapeutic engagements with place,[7300941]
445,The paper also explores CareFarming and how animals can initiate a change from Care Recipient to Care Giver,[7300941]
446,Very proud of my very brainy other half   ! therapeutic landscapes/ care farming etc,[7300941]
447,"Never did manage to sneak in a Simpsons reference sadly, but the stuff about Paro is in there",[7300941]
448,Really interesting seeing ways animals bound up in therapeutic relationships! Published something similar,[7300941]
449,Really interesting seeing ways animals bound up in therapeutic relationships! Published something similar h,[7300941]
450,New paper by   discusses therapeutic landscapes and non-human animals in care farming assemblages,[7300941]
451,My paper on 'Therapeutic landscapes and non-human animals' in   has just reached 200 views! CareFarming,[7300941]
452,My paper on 'Therapeutic landscapes and non-human animals' in   has just reached 200 views! CareFarming ht,[7300941]
453,and see his SandCG paper at,[7300941]
454,Exciting! My paper on Therapeutic Spaces and Animals is out of Earlyview and in new issue of   - free eprint,[7300941]
455,Thought this might be of interest,[7300941]
456,"Well done, Rich! Can't wait to read it!",[7300941]
457,"Richard Gorman, Cardiff Uni makes a strong argument for centering the agency of animals in therapeutic landscapes",[7300941]
458,Exciting! My paper on Therapeutic Spaces and Animals is out of Earlyview and in new issue of   - free eprint h,[7300941]
459,My new paper in   exploring role of animals in creating and facilitating therapeutic engagements with place h,[7300941]
460,"Socio-Cultural Factors as Antecedents of Cross-Cultural Adaptation in Expatriates, International Students, an",[7338219]
461,"Socio-Cultural Factors as Antecedents of Cross-Cultural Adaptation in Expatriates, International Students and Migrants",[7338219]
462,"SAGEpsychology Socio-Cultural Factors as Antecedents of Cross-Cultural Adaptation in Expatriates, International",[7338219]
463,"Socio-Cultural Factors as Antecedents of Cross-Cultural Adaptation in Expats, Intl Students, Migrants",[7338219]
464,"We've had the male, female, White, and tourist gazes Add the GoPro gaze to the list",[7350261]
465,Excited to see this article on the 'Go Pro Gaze' Of interest to you too I bet,[7350261]
466,ClassicNRPR The GoPro Gaze,[7350261]
467,This is such masturbation,[7350261]
468,Let us not forget the important discovery of the GoPro gaze in cultural geography,[7350261]
469,Not to be confused with the GoPro gaze,[7350261]
470,Cut From the Same Cloth Similarly Dishonest Individuals Across Countries  By   and colleagues,[7369737]
471,Does dishonest behavior across societies connect to similar core beliefs in individuals? Find out Psychology,[7369737]
472,Does dishonest behavior across societies connect to similar core beliefs in individuals? Find out,[7369737]
473,New article on art in post-conflict Bosnia now online in the journal Cultural Geographies,[7375804]
474,"cover image, Mladen Miljanovi, who also did this pivotal piece",[7375804]
475,On the importance of collaborations across species,[7378666]
476,"Developmental Latent Patterns of Identification as Mostly Heterosexual Versus Lesbian, Gay, or",[7465222]
477,"Youth who identify as ""LGB"" do so by ages 12-17 youth who ID as ""MostlyHetero"" take longer starting around 14",[7465222]
478,"Developmental Latent Patterns of Identification as Mostly Heterosexual Versus Lesbian, Gay, or Bisexual",[7465222]
479,Another scientific breakthrough in cultural geography,[7467401]
480,My article out in CulturalGeographies The Search for Publics Challenging Comfort Zones in PublicArt Co-Creation,[7467401]
481,"New in SCG, Yeoh et al Indonesian domestic workers and unmaking of transnational livelihoods and provisional futures",[7584254]
482,How are the transnational livelihoods and provisional futures of Indonesian domestic workers in Singapore unmade? ,[7584254]
483,How are the transnational livelihoods and provisional futures of Indonesian domestic workers in Singapore unmade?,[7584254]
484,New pub risk-taking and aspirations by Indonesian domestic workers First 50 downloads free,[7584254]
485,New publication by   risk-taking and aspirations by Indonesian domestic workers ,[7584254]
486,'stories to come' and Indonesian domestic workers - Brenda Yeoh/NUS,[7584254]
