,body,cites_papers
0,"Reward-Modulated Response Inhibition, Cognitive Shifting, and the Orbital Frontal Cortex in Early Adolescence",[2680251]
1,Mothers Goals for Adolescents in the United States and China Content and Transmission,[2751924]
2,Family Influences on Mexican American Adolescents Romantic Relationships Moderation by Gender and Culture,[2751930]
3,"Negative Stereotypes of Ethnic Outgroups A Longitudinal Examination Among Palestinian, Israeli Jewish, and Israel",[2808936]
4,"Negative Stereotypes of Ethnic Outgroups A Longitudinal Examination Among Palestinian, Israeli Jewish, and Is",[2808936]
5,"Negative Stereotypes of Ethnic Outgroups A Longitudinal Examination Among Palestinian, Israeli",[2808936]
6,The Home and the Hood Associations Between Housing and Neighborhood Contexts and Adolescent Functioning,[2864435]
7,"School Belonging, Generational Status, and Socioeconomic Effects on Mexican-Origin Children's Later Academic C",[2962255]
8,"School Belonging, Generational Status, and Socioeconomic Effects on Mexican-Origin Children's Later Academic Compe",[2962255]
9,Experiences With Parents and Youth Physical Health Symptoms and Cortisol A Daily Diary Investigation,[2977312]
10,PRI associates Susan McHale and David Almeida investigate the  association between adolescents' positive and,[2977312]
11,study Experiences With Parents and Youth Physical Health Symptoms and Cortisol A Daily Diary Investigation,[2977312]
12,"Gender, Generational Status, and ParentAdolescent Sexual Communication Implications for Latino/a Adolescent",[3049785]
13,"Gender, Generational Status, and ParentAdolescent Sexual Communication Implications for Latino/a Adolescent Sexu",[3049785]
14,Latino parents discussing sexual health consequences w/ teens predicted higher odds of intercourse 1 yr later,[3049785]
15,"Deflected Pathways Becoming Aggressive, Socially Withdrawn, or Prosocial With Peers During the Transition to",[3053140]
16,Here's my article in the issue 'Geographies of generation age restrictions in international adoption',[4072838]
17,Read about age restrictions in international adoption by   in Social and Cultural Geog scgjournal,[4072838]
18,"And a few more free views available for my new SCG article on ""matching"" parent and kid ages in int'l adoption' ",[4072838]
19,Last year I wrote an article about age restrictions on internationally adopting parents - free download here,[4072838]
20,"Powerful writing by   on living through, with, on, breastcancer in Social and Cultural Geography",[4183476]
21,Social and Cultural Geography contains a paper by my   colleague   on living on from breast cancer,[4183476]
22,Social and Cultural Geography contains a paper by my   colleague   on living on from breast cancer  ,[4183476]
23,Can anyone point me to autobiographical work by scholars on illness? So far I've read this powerful piece highered,[4183476]
24,Can anyone point me to autobiographical work by scholars on illness? So far I've read this powerful piece highered ,[4183476]
25,Books by Jackie Stacey and   on cancer are brilliant,[4183476]
26,The medical humanities community will undoubtedly have lots of ideas,[4183476]
27,"Social and Cultural Geog does care New articles by Juhila et al,","[4216920,4216922]"
28,Interesting piece on mental health home visits and the institutionalisation of domestic spaces in,[4216920]
29,"Gustavo Oliveira on ""The Geopolitics of Brazilan Soybeans""",[4269856]
30,Places and Postures A Cross-Cultural Comparison of Sitting in 5-Month-Olds - quite amazing,[4298540]
31,"The Acculturation of Parenting Cognitions A Comparison of South Korean, Korean Immigrant, and European Americ",[4514945]
32,"Lulle, A and King, R 2015 Ageing well the timespaces of possibility for older female Latvian migrants in the UK",[4557136]
33,Redesigned Taylor andFrancis group website Looks good!,[4557136]
34,Newly published piece by my doc student A grammar for black education beyond borders,[4799793]
35,Yes,[4799793]
36,The publishing machine that is   has another new paper out - in Social and Cultural Geography this time,[4966283]
37,The publishing machine that is   has another new paper out - in Social and Cultural Geography this time ,[4966283]
38,New Article Student geographies and homemaking personal belongings and identities by,[4966283]
39,Lovely paper on the micro-geographies of student accommodation Have longed for a sink in my bedroom ever since,[4966283]
40,"On student homes Just published Social and Cult Geog, by Mark Holton of   and Mark Riley scgjournal",[4966283]
41,"On student homes Just published Social and Cult Geog, by Mark Holton of   and Mark ",[4966283]
42,Out now   and Mark Riley's paper on the role of personal belongings in student geographies and homemaking,[4966283]
43,Out now   and Mark Riley's paper on the role of personal belongings in student geographies and homemaking ,[4966283]
44,My latest paper on belonging and homemaking in student bedrooms is now available in print,[4966283]
45,Student geographies and homemaking personal belongings and identities,[4966283]
46,"Newly published in Social and Cult Geog, a very timely paper on zinneke parade in Brussels by Reyskens et al",[4979580]
47,Peter Reyskens and Joke Vandenabeele use a video record of Brussels' Zinneke Parade to question urban togetherness,[4979580]
48,"To welcome all our new followers, this paper - on urban togetherness in Brussels - is free to access until Aug",[4979580]
49,"I have a new short piece online in SocandCultGeog on social media, images and cultural geog",[4997953]
50,"my new piece, part of a special issue on cultural geog now, with   among others",[4997953]
51,A call from Gillian Rose   for cultural geography to take social media seriously,[4997953]
52,Cultural geography going viral  Gillian Rose virality ANT materiality,[4997953]
53,"New in   Agrarian Classics series Anton Blok, 'The mafia of a Sicilian village, 18601960'",[4998150]
54,1st essay in the AgrarianClassics series is FreeAccess - Michael Watts on Blok's 'The mafia of a Sicilian village',[4998150]
55,1st essay in the AgrarianClassics series is FreeAccess - Michael Watts on Blok's 'The mafia of a Sicilian village' h,[4998150]
56,"The mafia of a Sicilian village, 18601960 a study of violent peasant entrepreneurs, Anton Blok",[4998150]
57,1st essay in the AgrarianClassics series FreeAccess - Michael Watts on Blok's 'The mafia of a Sicilian village',[4998150]
58,Neighborhood Qualification of the Association Between Parenting and Problem Behavior,[5000783]
59,Neighborhood Qualification of the Association Between Parenting and Problem Behavior Trajectories Among Mexican,[5000783]
60,Neighborhood Qualification of the Association Between Parenting and Pr,"[5000783,5000783]"
61,Neighborhood Qualification of the Association Between Parenting and Problem Behavior Trajectories Among,[5000783]
62,Can't beat Foucault need to read this!!,[5002409]
63,Enjoyed this article! Check out this paper via,[5002409]
64,"HIV, Viral Suppression, and New Technologies of Surveillance and Control",[5002409]
65,"HIV, Viral Suppression and New Technologies of Surveillance and Control The global response  bodyandsociety",[5002409]
66,Reading the Human Brain,[5003065]
67,"""Reading the Human Brain How the Mind Became Legible""   in Body and Society histpsych",[5003065]
68,"""Reading the Human Brain How the Mind Became Legible""   in Body and Society histp",[5003065]
69,"""Reading the Human Brain How the Mind Became Legible,""  's new piece in BodyandSociety",[5003065]
70,"Is it possible to read the mind, could authorities in the criminal justice system or the security services? Yes",[5003065]
71,Reading the Human Brain How the Mind Became Legible,[5003065]
72,"From the excellent   ""Reading the Human Brain How the Mind Became Legible neuro",[5003065]
73,Article available here  openaccess,[5003065]
74,"Teen Dating Violence, Sexual Harassment, and Bullying Among Middle School Youth Examining Measurement Invarian",[5016739]
75,"Teen Dating Violence, Sexual Harassment, and Bullying Among Middle School Youth Examining",[5016739]
76,Effect of Trajectories of Friends' and Parents' School Involvement on Teens' Engagement and Achievement HT,[5016943]
77,"Interesting paper by Gavin Smith on surveillance, data and embodiment and the work of being watched",[5024110]
78,"Surveillance, Data and Embodiment On the Work of Being Watched research",[5024110]
79,"Direct link, I find that Aussie universities are underrated -- Surveillance, Data and Embodiment via",[5024110]
80,"Surveillance, Data and Embodiment On the Work of Being Watched policestate surveillance panopticon",[5024110]
81,"Surveillance, Data and Embodiment On the Work of Being Watched by",[5024110]
82,"oops, here's right link",[5024110]
83,"Surveillance, Data and Embodiment On the Work of BeingWatched via",[5024110]
84,"Just published new essay looking at the relationship between surveillance, data and embodiment Check it out",[5024110]
85,"Surveillance, Data, and Embodiment On the Work of Being Watched",[5024110]
86,"Great article - Surveillance, Data and Embodiment On the Work of Being Watched Gavin JD Smith, 2016 -",[5024110]
87,"Lovely, brilliant read -  Surveillance, Data and Embodiment On the Work of Being Watched Gavin J D Smith, 2016 -",[5024110]
88,Performance fatigue as result of sustaining our data proxies - perpetually contactable and on virtual display - ,[5024110]
89,"The impact of managing the data and signals that leak from our bodies - Smith, 2016 -   ",[5024110]
90,Nourishing our parasitic data-proxies to maintain our digital reputations and identities I am what I post,[5024110]
91,"Worth reading ""Surveillance, Data and Embodiment On the Work of Being Watched"" by   paywalled",[5024110]
92,"Worth reading ""Surveillance, Data and Embodiment On the Work of Being Watched"" by",[5024110]
93,On the Work of Being Watched todays bodies are akin to walking sensor platforms cc,[5024110]
94,"Surveillance, Data and Embodiment On the Work of Being Watched",[5024110]
95,"Bodies either host, or are the subjects of, an array of sensing devices",[5024110]
96,On the Work of Being Watched todays bodies are akin to walking sensor platforms cc  ,[5024110]
97,"Surveillance, Data and Embodiment On the Work of Being Watched Todays bodies are akin to  bodyandsociety",[5024110]
98,"Surveillance, Data and Embodiment On the Work of Being Watched some v interesting social theory in this new article",[5024110]
99,"Surveillance, Data and Embodiment On the Work of Being Watched some v interesting social theor",[5024110]
100,"Managing a virtual presence is analogous to a work relation, demanding diligence and investment",[5024110]
101,A paper exploring the meanings and consequences of data-driven living for understandings of embodiment body biopo,[5024110]
102,Well done  !! Great reading on the intersections of surveillance and the body,[5024110]
103,"""Todays bodies are akin to walking sensor platforms"" By",[5024110]
104,"""Todays bodies are akin to walking sensor platforms"" By   ",[5024110]
105,A paper exploring the meanings and consequences of data-driven living for understandings of embodiment,[5024110]
106,A paper exploring the meanings and consequences of data-driven living for understandings of embodiment body biopo htt,[5024110]
107,New papers's out 'Indigenous Australian transformational resistance as a driver of academic achievement' HigherEd,[5025595]
108,"'It becomes almost an act of defiance indigenous Australian transformational resistance as a,  ,",[5025595]
109,Predicting Well-Being and Internalizing Symptoms in Late Adolescence From Trajectories of Externalizing Behavio,[5026247]
110,Predicting Well-Being and Internalizing Symptoms in Late Adolescence From Trajectories of,[5026247]
111,Adverse externalizing trajectories across childhood predict later low wellbeing in 18year olds in low-risk families,[5026247]
112,Han drifters in Lhasa the ambivalent cultural politics of Tibetanness amidst Chinas geographies of modernity,[5069638]
113,Han Chinese drifters in Lhasa Junxi Qian and Hong Zhu debate the ambivalent cultural politics of Tibetanness,[5069638]
114,Context of First Same-Sex Condom Use and Nonuse in Young Black Gay and Bisexual Males -,[5069689]
115,Context of First Same-Sex Condom Use and Nonuse in Young Black Gay and Bisexual Males,[5069689]
116,"What predicts condom nonuse in gay/bi black men? Partner trust, frequent HIV tests, lack of info, unsupportive peers",[5069689]
117,Context of 1st Same-Sex Condom Use and Nonuse in Young Black Gay and Bisexual Males a HT   LGBT Queer,[5069689]
118,Context of 1st Same-Sex Condom Use and Nonuse in Young Black Gay and Bisexual Males a HT  ,[5069689]
119,Adolescent Life Stress and the Cortisol Awakening Response The Moderating Roles of Attachment,[5070887]
120,Teens' closeness w peers and parents buffers effects of stress on cortisol stress response ThatsWhatFriendsAreFor,[5070887]
121,Moms play an essential role in getting their teens to take math and science classes in high school,[5073012]
122,The Role of Mothers' Communication in Promoting Motivation for Math and Science Course-Taking in High School,[5073012]
123,Great to see all the hard work pay off!,[5073761]
124,Open Access UCL Research Beyond geopower earthly and anthropic geopolitics in The Great Game by War Boutique,[5073761]
125,Netherlands greater classroom and neighborhood diversity linked to kids choosing same vs cross-ethnic friends!,[5084482]
126,"Which is a reflection of diversity in schools More of, more kids segregate",[5084482]
127,The Impact of Adolescents' Classroom and Neighborhood Ethnic Diversity on Same- and Cross-Ethnic Friendships on,[5084482]
128,The Impact of Adolescents' Classroom and Neighborhood Ethnic Diversity on Same- and Cross-Ethnic Friendships,[5084482]
129,Study finds - again - classroom diversity increases same-ethnicity friendships conflict theory adolescence,[5084482]
130,haha!  ,[5084482]
131,Interesting study of how diverse classes increase same-ethnic friendships   soc007 ConflictTheory,[5084482]
132,Interesting study of how diverse classes increase same-ethnic friendships   soc007 C,[5084482]
133,Hurrah to   and   on their new SCG paper Celtic pilgrimage past and present free OA geography,[5089127]
134,Hurrah to   and   on their new SCG paper Celtic pilgrimage past and present f,[5089127]
135,", my co-written article on Celtic pilgrimage, with a nice ecumenical slant!",[5089127]
136,New issue of Social and Cultural Geog is an   fest - also includes this on Celtic pilgrimage scgjournal,[5089127]
137,New issue of Social and Cultural Geog is an   fest - also includes this on Celtic pilgrimage,[5089127]
138,"""Celtic pilgrimage, past and present"" by   and   Free to access",[5089127]
139,A new open access paper on Celtic pilgrimage from   and   in Social and Cult Geog,[5089127]
140,"Highway to Heaven' the creation of a multicultural, religious landscape in suburban Richmond, British Columbia","[5092034,5092034]"
141,"et al explore the creation of a multicultural, religious landscape in suburban British Columbia",[5092034]
142,"Open Access UCL Research 'Highway to Heaven' the creation of a multicultural, religious landscape in suburban",[5092034]
143,"Open Access UCL Research 'Highway to Heaven' the creation of a multicultural, religious landscape in suburban ",[5092034]
144,Long-Term Predictions From Early Adolescent Attachment State of Mind to Romantic Relationship,[5096515]
145,Long-Term Predictions From Early Adolescent Attachment State of Mind to Romantic Relationship Behaviors,[5096515]
146,Which relationship is more important spouse or parent/child? Differences between Taiwan and USA,[5097388]
147,"Spec Issue in Social and Cultural Geography on relationships between Anglo and German geo, intro free TeamMultilingual",[5104802]
148,"Spec Issue in Social and Cultural Geography on relationships between Anglo and German geo, intro free TeamMultilingual ",[5104802]
149,Interesting article on the intersections of German and English-language geography,[5104802]
150,Reading Jns and Freytag 2016   article In praise of the boundary spanners! TeamMultilingual,[5104802]
151,Boundary spanning in social and cultural geography Dcloisonnement en gographie sociale et culturelle La,[5104802]
152,Online 1st in SandCG 'Attitudes towards the stranger negotiating encounters with difference in the UK and Poland',[5105786]
153,Online 1st in SandCG 'Attitudes towards the stranger negotiating encounters with difference in the UK and Poland' ,[5105786]
154,New in SCG by   Attitudes towards the stranger encounter,[5105786]
155,Attitudes towards the stranger negotiating encounters with difference in the UK and Poland brexitAcademia,[5105786]
156,Science Where contact between majority and minority groups takes place matters interactions in social spaces mor,[5105786]
157,Where contact between majority and minority groups takes place matters interactions in so,[5105786]
158,Where contact between majority and minority groups takes place matters interactions in social spaces more likely ,[5105786]
159,Support for a social identity analysis of overseas students' experience of discrimination,[5197150]
160,A Longitudinal Study of the Effects of Discrimination on the Acculturation Strategies of International Students,[5197150]
161,Great to see my paper on neighbourhood change and loss of belonging online in Social and Cultural Geography!,"[5307960,5307960]"
162,Narratives of neighbourhood change and loss of belonging in an urban garden village is discussed by,[5307960]
163,Publication is online - thanks to everyone involved   phdife geography,[5610760]
164,My paper presented at last year's RGS has been published There is still chance to present this year,[5610760]
165,My paper presented at last year's RGS has been published There is still chance to present this year ,[5610760]
166,Publication is online - thanks to everyone involved   phdife geography   ,[5610760]
167,Cultural geographers - just wanna have fun,[5610760]
168,How notions of 'the comic' could add value to geographers' research free,[5610760]
169,"this is cool, check this out too",[5610760]
170,Geographer   takes laughter seriously Check out his interesting new paper  ,[5610760]
171,Geographer   takes laughter seriously Check out his interesting new paper   ,[5610760]
172,I agree! Check out his Cultural Geographies paper here ComicGeographies lolGeography,[5610760]
173,Re-inventing the commons?   fellow D Paudel sees Nepal communityforestry as doing so,[5615382]
174,Re-inventing the commons community forestry as accumulation without dispossession in Nepal,[5615382]
175,"Batman Surveillance and the Body-subject - Ball, et al, 2016 - ",[5622278]
176,"Big Data Surveillance and the Body-subject - Ball, et al, 2016 - ",[5622278]
177,Big Data Surveillance and Body-Subject,[5622278]
178,Batman Surveillance and Body-Subject,[5622278]
179,Big Data Surveillance and the Body-subject This paper considers the implications of big data bodyandsociety,[5622278]
180,Big Data Surveillance and the Body-subject Body Society June 2016 222 58-81,[5622278]
181,keywords big data Levinas Merleau-Ponty normativity proximity subjectivity surveillance,[5622278]
182,Congrats to Ed Wigley on publication of paper on micro-pilgrimage in Bristol in SCG,[5623975]
183,Edward Wigley considers the Sunday morning journey to church as a form of micro-pilgrimage,[5623975]
184,Review of Rescripting Religion in the City Migration and Religious identity in the Modern Metropolis by,[5624556]
185,New paper in scgjournal on   project youth nation history   Gobaith Cymru,[5973297]
186,New paper in scgjournal on   project youth nation history   Gobaith Cymru ,[5973297]
187,It's urdd2016 this week - 17 5   inc paper on   Gobaith Cymru,[5973297]
188,It's urdd2016 this week - 17 5   inc paper on   Gobaith Cymru   ,[5973297]
189,OA Youth organisations and the reproduction of nationalism in Britain the role of Urdd Gobaith Cymru,[5973297]
190,This article might be useful for your research on FGM laws,[6008482]
191,"New OA paper in scgjrnl from G Valentine and C Harris on ""Encounters and intolerance"" and the regulation of space",[6008482]
192,"New OA paper in scgjournal from Valentine and Harris on ""Encounters and intolerance"" and the regulation of space",[6008482]
193,Encounters and intolerance perceptions of legality and regulation of space - new OA article by Prof Gill Valentine,[6008482]
194,Encounters and intolerance perceptions of legality and regulation of space - new OA article by Prof Gill Valentine h,[6008482]
195,Important paper post Brexit -   and   on legitimising prejudice,[6008482]
196,You can read about the research in Gill Valentine and Catherine Harris article on Encounters and intolerance 4/5,[6008482]
197,You can read about the research in Gill Valentine and Catherine Harris article on Encounters and intolerance,[6008482]
198,Important paper post Brexit -   and   on legitimising prejudice ,[6008482]
199,In a new OpenAccess OA paper   and   theorize geographies of encounter and intolerance,[6008482]
200,In a new OpenAccess OA paper   and   theorize geographies of encounter and intolerance ,[6008482]
201,"New paper on gentrification, adaptive reuse, and Toronto's churches by Nick Lynch geog3701",[6009129]
202,"""how redundant worship spaces are appropriated and transformed into private domestic spaces""",[6009129]
203,"""Appropriating religion as secular commodity"" and rejecting ""mainstream housing culture""",[6009129]
204,"New paper by N Lynch in Social and Cultural Geog on ""Domesticating the church the reuse of urban churches"" scgjrnl",[6009129]
205,"New paper by N Lynch in Social and Cultural Geog ""Domesticating the church the reuse of urban churches"" scgjournal",[6009129]
206,"New paper on gentrification, adaptive reuse, and Toronto's churches by Nick Lynch geog3701   ",[6009129]
207,Nicholas Lynch from   explores the reuse of urban churches as loft living in the post-secular city,[6009129]
208,Just came across Peter Jackson's excellent forthcoming piece in Social and Cultural Geog on Jamie's School Dinners,[6014404]
209,Just came across Peter Jackson's excellent forthcoming piece in Social and Cultural Geog on Jamie's School Dinners ,[6014404]
210,"A new paper by   just out in Social and Cultural Geography on ""More-than-human warfare"" scgjrnl",[6018649]
211,"A new paper by   just out in Social and Cultural Geography on ""More-than-human warfare"" scgjournal",[6018649]
212,Super excited to read this paper on 'more-than-human warfare' by   in,[6018649]
213,"Ruth Olden on 'Sludge' - everyday circulations, turbidity and the work to create order in wastewater management",[6019141]
214,"Such a waste, indeed",[6019141]
215,Great piece by   exploring mediation and how we address technologies of popular culture in our geographies,[6023516]
216,Great piece by   exploring mediation and how we address technologies of popular culture in our geographies ,[6023516]
217,asks in Social and Cultural Geog if popular cultural geographies should be more vulgar scgjournal,[6023516]
218,asks in Social and Cultural Geog if popular cultural geographies should be more vulgar ,[6023516]
219,My latest paper on the relational turn in island studies Just out in Social and Cultural Geography,[6023829]
220,"New paper by   on ""the relational turn in island geographies"" out in Social and Cultural Geog SCGjournal",[6026544]
221,"New provocation in SCGjournal by Dydia DeLyser ""Careful work building public cultural geographies""",[6026544]
222,"New paper by   on ""the relational turn in island geographies"" out in Social and Cultural Geog",[6026544]
223,"New paper by   in Social and Cultural Geography ""Hate-crimes as racial violence"" scgjournal",[6038824]
224,"New paper by   in Social and Cultural Geography ""Hate-crimes as racial violence"" scgjo",[6038824]
225,Hate-crimes as racial violence a critique of the exceptional,[6038824]
226,A new provocation in Social and Cultural Geog -   asks about cultural geographies of development scgjournal,[6040266]
227,A new provocation in Social and Cultural Geog -   asks about cultural geographies of development,[6040266]
228,My new article on memories of migration + public space just out in Social and Cultural Geography,[6053037]
229,Just out in Social and Cultural Geog R Tchoukaleyska on Public Space and memories of migration in France scgjournal,[6053037]
230,New from URP scholars/ARC Queering Disasters! Disaster impacts on LGBT memory + history by   +,[6104268]
231,New work from ARC Queering Disasters! Disaster impacts on LGBT memory + history by   + me,[6104268]
232,New in Social and Cultural Geog   and colleagues on LGBT experiences of natural disasters scgjournal,[6104268]
233,New in Social and Cultural Geog   and colleagues on LGBT experiences of natural disasters ,[6104268]
234,Feminist glaciology not a hoax Follow-up work How disasters affect homosexuals differently,[6104268]
235,Feminist glaciology not a hoax Follow-up work How disasters affect homosexuals differently h,[6104268]
236,New Queering Disasters article 'The greatest loss was the loss of our history',[6104268]
237,New publication from URP researchers   and   for the ARC Queering Disasters Project,[6104268]
238,New Queering Disasters article 'The greatest loss was the loss of our history'   ,[6104268]
239,"Smith, Blazek, Brown and van Blerk analyse the relational geographies of social policy and youth mentoring interventions",[6125798]
240,"Smith, Blazek, Brown and van Blerk analyse the relational geographies of social policy and youth mentoring interventions ",[6125798]
241,OA Its good but its not enough the relational geographies of social policy and youth mentoring inter,[6125798]
242,"'And now the end is near enlivening and politizising the geographies of dying, death and mourning'",[6132301]
