,body,cites_papers
1983,"New paper  AprilAugust temperatures in the Czech Lands, 14992012, reconstructed from grape-harvest dates",[5297534]
1984,"CP AprilAugust temperatures in the Czech Lands, 14992012, reconstructed from grape-harvest dates",[5297534]
1985,"AprilAugust temperatures in the Czech Lands, 14992012, reconstructed from grape-harvest dates",[5297534]
1986,Grape harvesting dates as a proxy measure of Central European temperatures back to the 15th century,[5297534]
1987,When did plankton colonize water column and  did it have an impact on Ordovician Radiation? by Servais et al  Palaeo3,[4762341]
1988,early Sprer Minimum  a period of extraordinary climate and  socio-economic changes in Western and Central Europe,[5517145]
1989,The early Sprer Minimum  a period of extraordinary climate and socio-economic changes in Western and Central,[5517145]
1990,The early Sprer Minimum  a period of extraordinary climate and  socio-economic changes in Western and Centra,[5517145]
1991,CP The early Sprer Minimum  a period of extraordinary climate and  socio-economic changes in Western and Centra,[5517145]
1992,New paper  The early Sprer Minimum  a period of extraordinary climate and  socio-economic changes in Western,[5517145]
1993,early Sprer Minimum  a period of extraordinary climate and  socio-economic changes in Western and Central Europe htt,[5517145]
1994,The Sprer Solar Minimum  a period of extraordinary climate and  socio-economic changes in Western and  Central Europe,[5517145]
1995,The Sprer Solar Minimum  a period of extraordinary climate and  socio-economic changes in Western and  Central Europe ht,[5517145]
1996,OS A harmonic projection and leastsquares method for quantifying Kelvin wave activity,[5517410]
1997,Oceanography OS  A harmonic projection and leastsquares method for quantifying Kelvin wave activity,[5517410]
1998,The onset of the Ordovician Plankton Revolution in the late Cambrian,[4762341]
1999,OS Effect of the North Equatorial Counter Current on the generation and propagation of internal solitary waves of,[5518001]
2000,Oceanography OS  Effect of the North Equatorial Counter Current on the generation and propagation of internal sol,[5518001]
2001,OS Long-term variability of the southern Adriatic circulation in relation to North Atlantic Oscillation,[5518002]
2002,Oceanography OS  Long-term variability of the southern Adriatic circulation in relation to North Atlantic Oscilla,[5518002]
2003,"Rich fauna of Devonian jawed polychaetes from Eifel, Germany  palaeobiogeography and  evolution",[5528331]
2004,"Tonarova, P -Middle Devonian Jawed polychate fauna from the type Eifel area, western Germany, and its b",[5528331]
2005,"Rich fauna of Devonian jawed polychaetes from Eifel, Germany  palaeobiogeography and  evolution ",[5528331]
2006,"Last glacial palaeoenvironments at Lascaux, S W  France, with special emphasis on MIS 4  ognon II interstadial   ",[5588114]
2007,Paleoenvironments at Lascaux during marine stage 4,[5588114]
2008,"New record of fossil wood Xenoxylon from Late Triassic in the Sichuan Basin, S  China and  palaeoclimate  ",[5607338]
2009,New  my first!  paper on inshore turbid-zone reef growth  coralreef,[4787760]
2010,"New record of fossil wood from Late Triassic in the Sichuan Basin, southern China and its paleoclimatic implications",[5607338]
2011,A calcareous nannofossil and  organic geochemical study of marine palaeoenvironment from ~191Ma in Portugal  ,[5609052]
2012,Paleoclimatic records of late Triassic palaeosols from C  Ethiopia  ,[5609053]
2013,Modeling precipitation 18O pariability in East Asia since the Last Glacial Maximum  temperature and amount effects,[5610490]
2014,CP Modeling precipitation 18O pariability in East Asia since the Last Glacial Maximum  temperature and amount ef,[5610490]
2015,Modeling precipitation 18O pariability in East Asia since LGM  temperature and  amount effects across time scales,[5610490]
2016,Modeling precipitation 18O pariability in East Asia since the Last Glacial Maximum  temperature and amount ef,[5610490]
2017,New paper  Modeling precipitation 18O pariability in East Asia since the Last Glacial Maximum  temperature an,[5610490]
2018,New  Trotter et al in press  New conodont 18O records of Silurian climate change  implications for env  and  bioevents,[4817697]
2019,New paper finds models cannot reproduce East African hydroclimate over the past Millennium,[5610983]
2020,"Detection and origin of different types of annual laminae in recent stalagmites from Zoolithencave, southern",[5610984]
2021,"CP Detection and origin of different types of annual laminae in recent stalagmites from Zoolithencave, southern G",[5610984]
2022,"New paper  Detection and origin of different types of annual laminae in recent stalagmites from Zoolithencave,",[5610984]
2023,OS How essential are Argo observations to constrain a global ocean data assimilation system?,[5616481]
2024,Oceanography OS  How essential are Argo observations to constrain a global ocean data assimilation system?,[5616481]
2025,"Global distribution of KppenGeiger climate types during the Last Glacial Maximum, Mid-Holocene, and present",[5623803]
2026,New online  new Californian Cretaceous pine ,[5624143]
2027,Excellent paper on Cretaceous pines and the taxonomic and morphological evolution of Pinaceae,[5624143]
2028,Everything you ever wanted to know about the  Silurian,[4817697]
2029,New online  new Californian Cretaceous pine,[5624143]
2030,We've described two new ancient kangaroos  Cookeroo bulwidarri and Cookeroo hourtusensis,[5626656]
2031,Palaeontologists just named a new kangaroo fossil genus as Cookeroo  Awesome,[5626656]
2032,We've described two new ancient kangaroos  Cookeroo bulwidarri and Cookeroo hourtusensis ,[5626656]
2033,"Cookeroo bulwidarri, a new 23 million year old kangaroo from Riversleigh  FossilFriday",[5626656]
2034,"Cookeroo, new genus of fossil kangaroo from Oligo-Miocene of Riversleigh, Australia    - v",[5626656]
2035,Cookeroo  Awesome name for 18-23 myo possible ancestor of modern kangaroos!  FossilFriday,[5626656]
2036,Cookeroo  Awesome name for 18-23 myo possible ancestor of modern kangaroos!  FossilFriday  ,[5626656]
2037,Huge CONGRATS to  - 1st paper for PhD just published! New Kangaroos!  fossils,[5626656]
2038,New species of Kangaroo just discovered! More details here,[5626656]
2039,"Interesting paper  Measuringand modeling lifetime of N2O including its variability, Prather et al",[4005670]
2040,"Our review paper on Large Igneous Provinces and their effect on Carbon and Sulphur cycles  Free download, enjoy!",[4822021]
2041,Get the low-down on this new study here!  kangaroos  fossils,[5626656]
2042,Get more details on the study here,[5626656]
2043,Cookeroo makes UK news  Find the research paper here   palaeontology  kangaroos,[5626656]
2044,And here is where you can find the relevant paper,[5626656]
2045,"Meet Cookeroo, new to science this week! More info here  FossilFriday  Kangaroo  Riversleigh",[5626656]
2046,"Cookeroo bulwidarri, a new 23 million year old kangaroo from Riversleigh  FossilFriday  ",[5626656]
2047,New carnivoraforms from Paleocene of Europe and  origin and  radiation of Carnivoraformes    - v,[5626657]
2048,Assessing performance and seasonal bias of pollen-based climate reconstructions in a perfect model world  Asse,[5628463]
2049,CP Assessing performance and seasonal bias of pollen-based climate reconstructions in a perfect model world,[5628463]
2050,New paper  Assessing performance and seasonal bias of pollen-based climate reconstructions in a perfect model world,[5628463]
2051,"Large Igneous Provinces, sulphur and carbon gasses paper Free download unitil Jan 18th  -",[4822021]
2052,Assessing performance and seasonal bias of pollen-based climate reconstructions in a perfect model world,[5628463]
2053,very short note on Kira's paper   I cannot really distinguish the supposed red dot In Fig 2a,[5628463]
2054,"Extreme storms during the last 6,500 years from lagoonal sedimentary archives in Mar Menor  SE SPAIN",[5629263]
2055,"New paper  Extreme storms during the last 6,500 years from lagoonal sedimentary archives in Mar Menor  SE SPAIN",[5629263]
2056,"CP Extreme storms during the last 6,500 years from lagoonal sedimentary archives in Mar Menor  SE SPAIN",[5629263]
2057,Oceanography OS  ,[5631657]
2058,"Meet Dromornis murrayi, a new species of dromornithid from the Northern Territory  Congrats to Trevor and  co!",[5634344]
2059,"Extinct flightless mihirungs  cranial anatomy, new species, and  Oligo-Miocene diversity    - v",[5634344]
2060,The third new fossil species for Australia this week  This time a Dromornithidae,[5634344]
2061,"Large Igneous Provinces, sulphur and carbon gasses paper Free download unitil Jan 18th  -   ",[4822021]
2062,New dromornithid Dromornis murrayi   birds  dinosaurs,[5634344]
2063,New magnificent mihirung named after brilliant palaeo and  artist Peter Murray  Riversleigh,[5634344]
2064,"The extinct flightless mihirungs  Aves, Dromornithidae   cranial anatomy and a new species,   pal",[5634344]
2065,"The extinct flightless mihirungs  Aves, Dromornithidae   cranial anatomy and a new species,   palaeontology",[5634344]
2066,The finer points of using a chemical  rocket to keep a  satellite in geostationary orbit,[5634547]
2067,Cross- polarization gives higher  contrast and better detail in images to study shape-shifting objects,[5634547]
2068,An energy-efficient warm-up routine for  lithium  batteries in freezing temperatures,[5634547]
2069,"1st amphisbaenians from Texas, with notes on other squamates from M  Eocene    - v",[5635705]
2070,First amphisbaenians from  Texas! Congrats  !    FossilFriday,[5635705]
2071,"Meet Solastella, a new  amphisbaenian from Texas!",[5635705]
2072,-  Sulphur/Carbon gases and LIPs,[4822021]
2073,First report of amphisbaenians from Texas  ~45-40 Ma,[5635705]
2074,"New material of a short-facedTrogosus from Bridgerian of California, US    - v   l",[5636391]
2075,1st virtual endocasts of a fossil rodent  Ischyromys typusand  brain evolution in rodents    - v,[5636713]
2076,"FossilFriday The amazing fossil squirrel Ischyromys  Photo of specimen from SDSM, recent paper on its brain here",[5636713]
2077,"FossilFriday The amazing fossil squirrel Ischyromys  Photo of specimen from SDSM, recent paper on its brain here  htt",[5636713]
2078,"CP Effects on the Czech Lands of the 1815 eruption of Mount Tambora  responses, impacts and comparison with the L",[5637266]
2079,"Effects on the Czech Lands of the 1815 eruption of Mount Tambora  responses, impacts and comparison with the",[5637266]
2080,"Effects on the Czech Lands of 1815 eruption of Tambora  responses, impacts and  comparison with Lakaggar 1783",[5637266]
2081,"Effects on the Czech Lands of the 1815 eruption of Mount Tambora  responses, impacts and comparison with the L",[5637266]
2082,"New paper  Effects on the Czech Lands of the 1815 eruption of Mount Tambora  responses, impacts and comparison",[5637266]
2083,High-res SIMS O isotope conodont apatite analysis from S  China and  implications for end-Permian mass extinction  ,[4850963]
2084,"Niche ontogeny is a pet fascination of mine, and a paper just came out looking at it in ichthyosaurs  Wonderful!",[5637791]
2085,Trophic niche ontogeny and palaeoecology of early Toarcian Stenopteryg,"[5637791,5637791]"
2086,"Hey     you've prob seen this already, but exactly what we were talking about the other day     ichthyosaurs",[5637791]
2087,"Niche ontogeny is a pet fascination of mine, and a paper just came out looking at it in ichthyosaurs  Wonderful! ",[5637791]
2088,Ichthyosaur teeth indicate diet changed during lifetime  FossilFriday,[5637791]
2089,Imbricate radial sculpture  a convergent feature within externally shelled cephalopods,[5637839]
2090,New paper analyses sculpture form and  structure in nautiloid and  ammonoid shells  FossilFriday,[5637839]
2091,Fossilized embryos reveal development patterns in extinct Cambrian jellyfish relatives,[5775064]
2092,"Early Cambrian embryo belonged to crown-group jellyfish, new  OpenAccess study in  Palaeontology reveals",[5775064]
2093,  Dong,"[5775064,5775064]"
2094,Pre-mass extinction animal body-size changes  evidence from PermianTriassic boundary brachiopods of S  China  ,[4850965]
2095,Embryonic development of a Cambrian Cnidarian,[5775064]
2096,1st reconstruction of dietary traits of Haploidoceros mediterraneus from NE Iberian peninsula  ,[5776922]
2097,The earliest pelagic jellyfish with rhopalia from Cambrian chengjiang Lagersttte  ,[5872600]
2098,The earliest pelagic jellyfish with rhopalia from Cambrian Chengjiang Lagersttte,[5872600]
2099,Biological and  physical evidence for extreme seasonality in central Permian Pangea  ,[5903713]
2100,A good e g  of how a thorough paleoclimatological study may be done,[5903713]
2101,Reassessment and reassignment of the early Maastrichtian mosasaur Hainosaurus bernardi to Tylosaurus,[5969278]
2102,Reassessment and  reassignment of E  Maastrichtian mosasaur Hainosaurus bernardi to Tylosaurus    -,[5969278]
2103,Sedimentary record and petrophysical logs across the lochkovian-pragian boundary in Spanish C  Pyrenees  ,[5972446]
2104,New! Thomka et al in press  Taphonomy of cystoids from the Napoleon quarry of IN  L Silurian Massie Fm Lagersttte,[4864467]
2105,Combined-mesowear analysis of late Miocene giraffids from North Chinese and  Greek localities of pikermian biome  ,[5972447]
2106,Combined-mesowear analysis of late Miocene giraffids from North Chinese and Greek localities of the Pikermian Biome,[5972447]
2107,OS Combining operational models and data into a dynamic vessel risk assessment tool for coastal regions,[5972689]
2108,Oceanography OS  Combining operational models and data into a dynamic vessel risk assessment tool for coastal reg,[5972689]
2109,Interactions between climate change and human activities during the Early to Mid Holocene in the East Mediterr,[5973238]
2110,New paper  Interactions between climate change and human activities during the Early to Mid Holocene in the Ea,[5973238]
2111,Interactions between climate change and human activities during the Early to Mid Holocene in the East Mediterranean,[5973238]
2112,CP Interactions between climate change and human activities during the Early to Mid Holocene in the East Mediterr,[5973238]
2113,Interactions between climate change and human activities during the Early to Mid Holocene in the E Mediterranean,[5973238]
2114,Avian egg from the Liangtoutang   dinosaurs  birds,[5976932]
2115,Note  that's the Thomka et al 2016 paper on 'cystoid' taphonomy,[4864467]
2116,"An avian egg from Lower Cretaceous Liangtoutang Formation of Zhejiang Province, China    - v",[5976932]
2117,"Ankylosaurian palaeoenvironmental association influenced by extirpation, sea-level fluctuation and  geodispersal",[5976994]
2118,Cool new study from   and   on ankylosaurian environmental preferences  dinosaurs,[5976994]
2119,Cool new study from   and   on ankylosaurian environmental preferences,[5976994]
2120,New research  Did armored  dinosaurs in Cretaceous favor different habitats?,[5976994]
2121,PDF available here!,[5976994]
2122,"New paper published, free access here   sciart  ankylosaurs",[5976994]
2123,Ankylosaur palaeoenvironments  Congrats,[5976994]
2124,"New paper published, free access here   sciart  ankylosaurs   ",[5976994]
2125,New in    Benedetto and  Muoz in press  Plectorthoid brachiopods from Lower Ordovician of NW Argentina,[5987441]
2126,A New Palaeoclimate Classification for Deep Time  ,[4865898]
2127,New online  Plectorthoid brachiopods from the Lower Ordovician of north-western Argentina,[5987441]
2128,New online  Plectorthoid brachiopods from the Lower Ordovician of north-western Argentina ,[5987441]
2129,New in    Benedetto and  Muoz in press  Plectorthoid brachiopods from Lower Ordovician of NW Argentina ,[5987441]
2130,New online  New bivalves from a Middle Devonian methane seep in Morocco,[5989534]
2131,"1st Jurassic frog from Siberia, Russia    - v",[5993910]
2132,"Orthogonikleithrus francogalliensis, sp  nov  from Late Jurassic of Cerin  France     - v",[5993932]
2133,CP Holocene hydrological changes of the Rhone River  NW Mediterranean  as recorded in the marine mud belt,[6001911]
2134,Holocene hydrological changes of the Rhone River  NW Mediterranean  as recorded in the marine mud belt  Holoce,[6001911]
2135,Holocene hydrological changes of the Rhone River  NW Mediterranean  as recorded in the marine mud belt,[6001911]
2136,New paper  Holocene hydrological changes of the Rhone River  NW Mediterranean  as recorded in the marine mud belt,[6001911]
2137,A new paleoclimate classification for deep time,[4865898]
2138,OS Transient tracer distributions in the Fram Strait in 2012 and inferred anthropogenic carbon content and transp,[6002015]
2139,Oceanography OS  Transient tracer distributions in the Fram Strait in 2012 and inferred anthropogenic carbon cont,[6002015]
2140,New paper from   et al  on new Bayesian method for credible intervals for durations of fossil taxa,[6004775]
2141,Now out  our decade-in-the-works paper on CIs on stratigraphic ranges w/o assuming uniform recovery      magnumopus,[6004775]
2142,"Our long-awaited paper on CIs for strat  ranges w/ non-unif  recovery functions, now in print   MagnumOpus",[6004775]
2143,Now out  our decade-in-the-works paper on CIs on stratigraphic ranges w/o assuming uniform recovery,[6004775]
2144,Could I get a copy of your paper  UM doesn't get Paleobiology?!?  josephwb at,[6004775]
2145,Includes a version of our Adaptive Beta Method  non-uniform confidence intervals on stratigraphic ranges  from,[6004775]
2146,Early Frasnian thelodont scales from C  Iran and  their implications for turiniid palaeobiology    - v,[6006647]
2147,Late Miocene and Pliocene pikeperches of S E  europe    - v,[6006648]
2148,Siberia volcanology paper free download till 18Jan  -,[4063220]
2149,"Boreal peatland water table depth and  carbon accumulation during Holocene thermal maximum, Roman Warm Period, and  MCA",[4868340]
2150,Paleobiology of sabretooth cat Smilodon populator in the Pampean Region  Insights from C/N stable isotopes,[6008017]
2151,The diet of Smilodon populator based on stable isotopes,[6008017]
2152,S populator in Argentina may have gone for large sloths,[6008017]
2153,Note Bobcat Perfection tail and coloration   2017MMM,[6008017]
2154,And I thought S populator was boring relative to S fatalis   what metal species names  2017MMM,[6008017]
2155,"Smilodon expanded from North America to South America during the ""Great American Biotic Interchange""  2017MMM",[6008017]
2156,"Jurassic-Cretaceous depositional environments and  evolution of Bilecik tauride CO3 platforms, Turkey  ",[6012533]
2157,"High-res organic C-isotope stratigraphy of Mid  Jurassic-Lower Cretaceous C  Spitsbergen, Svalbard  ",[6012534]
2158,New paper in our research group by   Organic carbon-isotope stratigraphy of the Agardhfjellet Fm,[6012534]
2159,Our paper on organic carbon isotope stratigraphy of the Agardhfjellet fm   Spitsbergen  is now available online,[6012534]
2160,"Ontario Boreal peatland water table depth and  carbon accumulation during Holocene thermal maximum, Roman Warm Period",[4868340]
2161,Multiproxy approach to climate and  marine productivity variations along MIS 5 in S E  Brazil  ,[6012535]
2162,Mid Miocene vegetation and  climate dynamics in Bulgaria and  Poland based on pollen data  ,[6018213]
2163,What causes vegetation changes on peatlands? Autogenic succession or climate? Find out in our latest paper,[6018483]
2164,Interesting look at the magnetic signature of tsunami propagation,[6018533]
2165,Just out  our new paper on climate reconstruction via tooth isotopes at Haua Fteah archaeological site  isotope,[6018643]
2166,Just out  our new paper on climate reconstruction via tooth isotopes at Haua Fteah archaeological site,[6018643]
2167,Checked out our new paper?  Palaeoenvironments via tooth  isotopes across Pleistocene Holocene transition N  Africa,[6018643]
2168,Seen   's recent paper? N African  Palaeoenvironments via tooth  stableisotopes,[6018643]
2169,"CP Environmental changes, climate and anthropogenic impact in southern-eastern Tunisia during the last 8 kyr",[6019967]
2170,"Environmental changes, climate and anthropogenic impact in southern-eastern Tunisia during the last 8 kyr",[6019967]
2171,Also new  Sigurdsen and  Hammer in press  Body size trends in the Ordovician to earliest Silurian of the Oslo Region,[4869962]
2172,"Environmental changes, climate and anthropogenic impact in southern-eastern Tunisia during the last 8 kyr  Env",[6019967]
2173,"New paper  Environmental changes, climate and anthropogenic impact in southern-eastern Tunisia during the last 8 kyr",[6019967]
2174,A new Upper Cretaceous titanosaur nesting site from La Rioja  NW Argentina,[6020259]
2175,A new Upper Cretaceous titanosaur nesting site from La Rioja,[6020259]
2176,New dinosaur nesting site in Argentina reveals habits of titanosaurs,[6020259]
2177,More recent  -supported research  a new sauropod nesting site in Argentina!,[6020259]
2178,Dust impact signals on the Wind spacecraft  AGUpubs,[6023344]
2179,ICYMI  Dust impact signals on the Wind spacecraft  AGUpubs,[6023344]
2180,"Concentrations of Si cephalopods within U  Frasnian CO3 concretions from the Holy Cross Mountains, Poland  ",[6026040]
2181,New ICTJA paper   Climate variability and human impact in South America       openaccess,[6026699]
2182,The Central American Seaway plays only a minor role in marine mammal distribution,[6026801]
2183,The palaeogeography of marine mammals in the northern hemisphere  new paper by   and     marinemammals,[6026801]
2184,The palaeogeography of marine mammals in the northern hemisphere  new paper by   and    ,[6026801]
2185,Congrats   on  the paper! Can't wait to sit down and read it,[6026801]
2186,Exploration of marine mammal paleogeography in the Northern Hemisphere over the Cenozoic,[6026801]
2187,Exploration of marine mammal paleogeography in the Northern Hemisphere over the Cenozoic using beta diversity,[6026801]
2188,Happy Whale Wednesday! Here's a new paper from Uhen Lab's Carlos Peredo and Mark D  Uhen about the paleogeography,[6026801]
2189,OS On the near-inertial variations of meridional overturning circulation in the South China Sea,[6030075]
2190,Oceanography OS  On the near-inertial variations of meridional overturning circulation in the South China Sea,[6030075]
2191,"Dietary and  environmental implications of E  Cretaceous predatory dinosaur coprolites from Teruel, Spain  ",[6033403]
2192,E  Devonian Palaeobiogeography of Eastern Australasia  ,[4877498]
2193,Dietary and  environmental implications of Cretaceous predatory  dinosaur coprolites  via    FossilFriday,[6033403]
2194,Dietary and  environmental implications of Cretaceous predatory  dinosaur coprolites  via  ,[6033403]
2195,Some of our new work on the Kibish Fm and paleoenvs of modern human origins out today--,[6045419]
2196,Paleoenvironmental reconstructions in Ethiopia! New research from out  ETEteam member Tyler Faith,[6045419]
2197,"New family of gymnodont fish from earliest Eocene of Peri-Tethys  N  Caucasus, Russia     - v",[6047411]
2198,New online  A new family of gymnodont fish from the earliest Eocene of the Peri-Tethys,[6047411]
2199,A new family of gymnodont fish  Tetraodontiformes  from the earliest  Eocene of the Peri-Tethys  Russia,[6047411]
2200,FossilFriday new earliest Eocene gymnodont fish  Massive beak-like jaws and  striking spines,[6047411]
2201,hal-00446718  Validation of the CALIPSO/CALIOP extinction coefficients from in situ,[6048670]
2202,"Stromatolites in Walker Lake  Nevada, Great Basin, USA  record climate and  lake level changes ~35Ka  ",[6049257]
2203," Blundell, AC, Holden     wrro",[4884752]
2204,Paper by    w/   on pre-LGM Walker Lake stromatolites!!!  isotopes  pluviallakes  Lahontan,[6049257]
2205,"What's this? Just some awesome work from the GeoBio 2014 students/instructors! Stromatolites in Walker Lake, NV",[6049257]
2206,New selachians from Patagonian U  Cretaceous  paleobiogeographical implications and  a new taxon    - v,[6050082]
2207,New species of Miocene rhino from Lake Victoria in    paleontology  fossils,[6052380]
2208,New Rhinocerotidae from Kisingiri localities  lower Miocene of Western Kenya     - v,[6052380]
2209,OS IEOOS  the Spanish Institute of Oceanography Observing System,[6052797]
2210,Oceanography OS  IEOOS  the Spanish Institute of Oceanography Observing System,[6052797]
2211,Fossil crocodilians from Colombia  Neogene faunal change in northernmost South America    - v,[6120661]
2212,Femoral ontogeny and  long bone histology of Asilisaurus kongwe and  growth in early dinosaurs    - v,[6127777]
2213,Late Miocene Pannonian Basin vegetation  ,[6127778]
2214,Generating multi-proxy Holocene palaeoenvironmental records from blanket peatlands,[4884752]
2215,Multi-proxy Palaeoecological responses To Water level fluctuations In 3 shallow Turkish lakes  ,[6127779]
2216,Multi-proxy palaeoecological responses to water level fluctuations In three shallow Turkish lakes,[6127779]
2217,Open Access UCL Research  Multi-proxy palaeoecological responses to water-level fluctuations in three shallow,[6127779]
2218,Latitudinal gradients and  indicator species in ungulate palaeoassemblages during MIS 3 in W Europe  ,[6127780]
2219,New  Lefebvre et al in press  Palaeoecological aspects of echinoderm diversification in lower Ordovician of Morocco,[6128950]
2220,"Palaeoecological aspects of the diversification of echinoderms in Lower Ordovician of central Anti-Atlas, Morocco",[6128950]
2221,Biostratigraphy and  paleoenvironments of Late Oligocene in N W  Transylvanian Basin revealed by foram assemblages  ,[6130869]
2222,Oceanography OS  ,[6132539]
2223,Congratulations to Jill  Evans  on the publication of the second paper from her MSc research!   you can get it,[6132566]
